"413","1","Ninja Scroll","ninja-scroll","2013/08/2641.jpg",NULL,"Movie","Complete","1993-06-05","0000-00-00","a:1:{i:0;s:6:""Subbed"";}","R+ - Mild Nudity","Jubei Kibagami has always been the master dealer of death, but in rescuing a ninja woman from a monster he sets loose a chain of events that puts death in his own veins and sends them on a nightmarish odyssey through a surreal and devil infested ancient Japan. How do demonic possessions, an annihilated village and a man Jubei thought safely buried in his past all connect? If Jubei can't piece the blood-soaked clues together, his only consolation will be that he won't live to regret it for very long! Prepare your mind and steel your gut for the insanely gore-packed orgy of violence that still stands alone and unchallenged as the ultimate anime action feature. ","1","1","94","Wind Ninja Chronicles","English: Ninja Scroll
Synonyms: Wind Ninja Chronicles, Juubei Ninpucho
Japanese: 獣兵衛忍風帖",NULL,NULL,NULL,NULL,NULL,"2013-09-07 00:16:11","2013-09-07 00:16:11","60817"
"414","1","Akira","akira","2013/08/47.jpg",NULL,"Movie","Complete","1988-07-16","0000-00-00","a:1:{i:0;s:6:""Subbed"";}","R+ - Mild Nudity","It's the year 2019, thirty-one years have passed since the start of World War III. A top-secret child with amazing powers of the mind breaks free from custody and accidentally gets a motorcycle gang involved in the project. This incident triggers psychic powers within one of the gang members, Tetsuo, and he is taken by the army to be experimented on. His mind has been altered and is now on the path of war, seeking revenge on the society that once called him weak. ","1","1","124",,"Japanese: アキラ",NULL,NULL,NULL,NULL,NULL,"2013-09-07 00:36:04","2013-09-07 00:36:57","60818"
"415","1","Dragon Ball Z Movie 14: Kami to Kami","dragon-ball-z-movie-14-kami-kami","2013/08/44490.jpg",NULL,"Movie","Complete","2013-03-30","0000-00-00","a:2:{i:0;s:6:""Subbed"";i:1;s:6:""Dubbed"";}","PG-13 - Teens 13 or older","The film is set between the 517th and 518th installments of Akira Toriyama's original manga. Specifically, it is set during the ""lost decade"" of story time after the end of the battle with Majin Buu. Kuririn, Piccolo, Vegeta, and other familar characters will appear in the film. The film is not a spinoff, but a story in the official history of Dragon Ball.","1","1","87","Dragon Ball Z: Battle of Gods","Synonyms: Dragon Ball Z 2013, DBZ (2013), Dragon Ball Z Battle of Gods, Saikyou Shidou
Japanese: ドラゴンボールZ: 神と神",NULL,NULL,NULL,NULL,NULL,"2013-09-07 00:40:04","2013-09-07 00:40:04","60819"
"416","1","Hunter x Hunter: Phantom Rouge","hunter-x-hunter-phantom-rouge","2013/08/53073.jpg",NULL,"Movie","Complete","2013-01-12","0000-00-00","a:1:{i:0;s:6:""Subbed"";}","PG-13 - Teens 13 or older","Kurapika became a Hunter to take vengeance on the Class-A crime group Phantom Troupe who massacred his clan for their unique eyes. The eyes of the Kurta clan turn scarlet in times of anger or emotional agitation and are considered the most beautiful treasures in the world. Kurapika continues to pursue the Phantom Troupe but an unknown party has stolen his ""scarlet eyes"". With the help of Gon, Killua and Leorio, Kurapika' s life was saved. However, the Phantom Troupe shows up before them and blocks their way. The true identity of the one with the No.4 spider tattoo is about to be unveiled. ","1","1","97",,"Synonyms: Gekijouban Hunter x Hunter: Hiiro no Genei, HxH Movie
Japanese: 劇場版 HUNTER×HUNTER 緋色の幻影（ファントム・ルージュ）",NULL,NULL,NULL,NULL,NULL,"2013-09-07 03:49:14","2013-09-07 03:49:14","60843"
"417","1","Mononoke Hime","mononoke-hime","2013/08/26570.jpg",NULL,"Movie","Complete","1997-07-12","0000-00-00","a:2:{i:0;s:6:""Subbed"";i:1;s:6:""Dubbed"";}","R - 17+ (violence & profanity)","A calm village residing in the mountains comes under attack from a demon-possessed boar one day.

Ashitaka, a young man and prince of the tribe, engages the creature in an attempt to save his village. During the battle, the boar bites him on the arm, leaving it blackened and cursed. Following his village's traditions, Ashitaka is exiled and becomes a wanderer, looking for a solution to the curse before it engulfs him.

Iron Town is a fortress under the leadership of Lady Eboshi. Through the clearing of the surrounding forests, Iron Town produces large amounts of Ironsand, used for gunpowder and other machinery. However, because of the forests destruction, nearby animal clans seek revenge led by a human girl of the Wolf clan called San.

When Ashitaka comes to Iron Town, he discovers the area consumed in battle. Horrified, he attempts to create peace and befriend the Wolf Clan. However, after the forest's eradication and the ongoing war between Human and Beast, will the Spirit of the Forest be forgiving and accept Ashitaka's request to expel his curse?","1","1","130","Princess Mononoke","English: Princess Mononoke
Japanese: もののけ姫",NULL,NULL,NULL,NULL,NULL,"2013-09-07 03:50:57","2014-01-19 16:22:11","60844"
"418","1","Majo no Takkyuubin","majo-takkyuubin","2013/08/Kikis-Delivery-Service.jpg",NULL,"Movie","Complete","1989-07-29","0000-00-00","a:2:{i:0;s:6:""Subbed"";i:1;s:6:""Dubbed"";}","G - All Ages","Kiki is an enterprising young girl who must follow tradition to become a full-fledged witch. Venturing out with only her chatty black cat, Jiji, Kiki flies off for the adventure of a lifetime. Landing in a far-off city, she sets up a high-flying delivery service and begins a wonderful experience of independence and responsibility as she finds her place in the world. ","1","1","105","Kiki's Delivery Service","English: Kiki's Delivery Service
Synonyms: Witch's Express Delivery
Japanese: 魔女の宅急便",NULL,NULL,NULL,NULL,NULL,"2013-09-07 03:52:24","2013-09-07 03:53:24","60845"
"419","1","Howl no Ugoku Shiro","howl-ugoku-shiro","2013/08/Howl-Moving-Castle.jpg",NULL,"Movie","Complete","2004-11-20","0000-00-00","a:2:{i:0;s:6:""Subbed"";i:1;s:6:""Dubbed"";}","G - All Ages","Sophie, a quiet girl working in a hat shop, finds her life thrown into turmoil when she is literally swept off her feet by a handsome but mysterious wizard named Howl. The vain and vengeful Witch of the Waste, jealous of their friendship, puts a spell on Sophie. In a life-changing adventure, Sophie climbs aboard Howl's magnificent flying castle and enters a magical world on a quest to break the spell.","1","1","117","Howl's Moving Castle","English: Howl's Moving Castle
Synonyms: Hauru no Ugoku Shiro
Japanese: ハウルの動く城",NULL,NULL,NULL,NULL,NULL,"2013-09-07 03:55:24","2013-09-07 03:55:47","60846"
"420","3","Dareka no Manazashi","dareka-manazashi","2013/09/46741.jpg",NULL,"Movie","Complete","2013-02-10","0000-00-00","a:1:{i:0;s:6:""Subbed"";}","G - All Ages","Short anime film by Makoto Shinkai screened at the Nomura Real Estate Group's ""Proud Box Kanshasai"" home living exposition, which ran February 10–11, 2013, at the Tokyo International Forum.
 ","1","1","6","Proud Future Theater","Japanese: だれかのまなざし",NULL,NULL,NULL,NULL,NULL,"2013-09-11 12:05:24","2013-09-11 23:28:55","61091"
"421","3","Denpa Teki na Kanojo","denpa-teki-na-kanojo","2013/10/14787.jpg",NULL,"OVA","Complete","2009-02-04","2009-12-04","a:1:{i:0;s:6:""Subbed"";}","R - 17+ (violence & profanity)","Juuzawa Juu is a delinquent high school boy who just wants to be left alone. One day, he is approached by Ochibana Ame, who claims that she knew him in a previous life, and now wants to serve him as his ""knight"". At first Juu wants nothing to do with Ame, but after a classmate is murdered, he accepts her help as he looks for the killer. 
 ","1","2","42","Denpateki na Kanojo","Synonyms: Denpateki na Kanojo
Japanese: 電波的な彼女",NULL,NULL,NULL,NULL,NULL,"2013-10-01 11:12:30","2013-10-01 11:12:30","63043"
"422","14","Ookami Kodomo no Ame to Yuki","ookami-kodomo-ame-yuki","2013/10/Wolf-Children.jpg",NULL,"Movie","Complete","2012-06-25","2012-06-25","a:2:{i:0;s:6:""Subbed"";i:1;s:6:""Dubbed"";}","G - All Ages","The theme of the film is the love between parents and children. The story covers 13 years and begins with a 19-year-old college student named Hana who encounters and falls in ""fairy tale-like"" love with a ""wolf man."" After marrying the wolf man, Hana gives birth and raises two wolf children—an older sister named Yuki who was born on a snowy day, and a younger brother named Ame who was born on a rainy day. The four quietly lived in a corner of a city to conceal the existence of the ""wolf children,"" but when the wolf man suddenly dies, Hana decides to move to a rural town far removed from the city.","1","1","117","Wolf Children","English: Wolf Children
Synonyms: The Wolf Children Ame and Yuki
Japanese: おおかみこどもの雨と雪",NULL,NULL,NULL,NULL,NULL,"2013-10-05 18:46:17","2013-10-05 18:46:17","63089"
"423","3","Coppelion ","coppelion","2013/10/51997.jpg",NULL,"TV","Complete","2013-10-02","2013-12-25","a:1:{i:0;s:6:""Subbed"";}","PG-13 - Teens 13 or older","In 2016, a meltdown of a nuclear power plant creates a big catastrophe in Tokyo. 20 years later, the city has become a ghost town due to the high levels of radiation. From that area a distress signal is received. The Self Defense forces dispatch three girls from the special unit Coppelion to search for survivors. But why aren't they wearing any protection against radiation?
 ","1","13","25",,"Japanese: コッペリオン",NULL,"7.6667",NULL,"1405549931",NULL,"2013-10-06 02:04:40","2014-02-15 08:35:53","63111"
"424","3","Kyoukai no Kanata","kyoukai-kanata","2013/10/53111.jpg",NULL,"TV","Complete","2013-10-02","2013-12-18","a:1:{i:0;s:6:""Subbed"";}","PG-13 - Teens 13 or older","The dark fantasy follows a high school sophomore named Akihito Kanbara. Although the boy appears human, he is half youmu and invulnerable to wounds because he can heal quickly. One day, Akihito meets freshman Mirai Kuriyama when it seems she is about to jump from the school rooftop. Mirai is isolated because of her ability to manipulate blood, which is unique even among members of the spirit world. Disturbing events begin to unfold after Akihito saves Mirai.
 ","1","12","24","Beyond the Boundary","English: Beyond the Boundary
Synonyms: Beyond the Horizon, Kyokai no Kanata
Japanese: 境界の彼方

 ",NULL,"0.0000",NULL,"1390360816",NULL,"2013-10-06 02:13:21","2014-01-05 08:59:40","63143"
"425","3","Kyousou Giga (TV)","kyousou-giga-tv","2013/10/53417.jpg",NULL,"TV","Complete","2013-10-10","2013-12-18","a:1:{i:0;s:6:""Subbed"";}","PG-13 - Teens 13 or older","Koto and her brothers, A and Un are stuck in a strange city causing massive mayhem through the land called Kyoto but not the Kyoto they are from. 
They are searching for an atypical rabbit in order to return home. Koto, who is the eldest of the three, seems to have some sort of connection to this weird place ruled by a monk, a demon, and a priest.
 ","1","10","26",,"Synonyms: Kyousougiga (TV), Kyousogiga (TV)
Japanese: 京騒戯画

 ",NULL,NULL,NULL,NULL,NULL,"2013-10-06 02:19:36","2013-12-21 05:15:19","63155"
"426","3","Kill la Kill","kill-la-kill","2013/10/54379.jpg",NULL,"TV","On-going","2013-10-03","0000-00-00","a:1:{i:0;s:6:""Subbed"";}","R - 17+ (violence & profanity)","The story is set on a high school that the student council president Satsuki Kiryuuin rules by force. Wielding a giant Basami scissors sword, the wandering transfer student Ryuuko Matoi brings about upheaval on the campus. Ryuuko searches for the mysterious figure who caused her father's death, but confronting her are the student council's ""four divine kings."" Fortunately, Ryuuko is aided by a talking sailor uniform who tells her, ""Wear me. When I am worn by you, this power will become manifest.""
 ","1","24","24",,"English: KILL la KILL
Synonyms: KLK
Japanese: キルラキル

 ",NULL,NULL,NULL,NULL,NULL,"2013-10-06 02:25:50","2013-12-20 22:35:22","63184"
"427","3","Golden Time","golden-time","2013/10/52091.jpg",NULL,"TV","On-going","2013-10-04","0000-00-00","a:1:{i:0;s:6:""Subbed"";}","PG-13 - Teens 13 or older","Tada Banri, a newly admitted student at a private law school in Tokyo, found himself completely lost after the opening ceremony, trying to find his way to the freshman orientation. At that moment, he ran into another lost freshman from the same school, Yanagisawa Mitsuo, and they hit it off at once. Somehow arriving at their intended goal just on time, there appeared in front of the two a beautiful girl holding a bouquet of roses. The girl then whacked Mitsuo across the face with the bouquet and handed the flowers over to him. ""Freshman, congratulations"", was all she said, and then left. The stylish, well dressed, perfect woman that had swung at Mitsuo was his childhood friend, Kaga Kouko. As children they had promised to marry each other one day, fulfilling their dreams. In order to escape from her, Mitsuo had gone out secretly and taken the examination for this well known private college, but now she showed up in the freshman orientation hall. She too had taken the law school entrance examination, catching up with him there.
 ","1","24","24",,"Japanese: ゴールデンタイム",NULL,"9.4667",NULL,"1405380312",NULL,"2013-10-06 08:04:17","2014-07-04 21:37:58","63223"
"428","3","Nagi no Asukara","nagi-no-asukara","2013/10/53549.jpg",NULL,"TV","On-going","2013-10-03","0000-00-00","a:1:{i:0;s:6:""Subbed"";}","PG-13 - Teens 13 or older","A beautiful fairy tale that wanders through the earth and the sea. Hikari Sakishima and Manaka Mukaido are Sea Dwellers and childhood friends. When their school in the sea is closed they are forced to attend one on land, but due to a special encounter, their lives gain a new twist.
 ","1","26","23","Nagi no Asu Kara","Synonyms: Nagi no Asu Kara
Japanese: 凪のあすから

 ",NULL,"10.0000",NULL,"1388389836",NULL,"2013-10-06 08:17:18","2014-01-19 16:22:11","63276"
"429","3","Yuusha ni Narenakatta Ore wa Shibushibu Shuushoku wo Ketsui Shimashita","yuusha-ni-narenakatta-ore-wa-shibushibu-shuushoku-wo-ketsui-shimashita","2013/10/54389-1.jpg",NULL,"TV","Complete","2013-10-05","2013-12-20","a:1:{i:0;s:6:""Subbed"";}","PG-13 - Teens 13 or older","The story revolves around Raul, a boy who did not become a Hero, since the demon lord was already defeated just before his Hero exams. His dreams dashed, Raul spends his days working at a magic shop in the capital. One day, a part-time job seeker appears at the shop with an amazing résumé:

Name: Phino 
Previous Occupation: Demon Lord Heir
Motive: Because my father was defeated

The work comedy revolves around this former Hero-in-training and the daughter of the demon lord.
 ","1","12","24","Yuushibu","Synonyms: Yu-sibu, Yusibu, Yuushibu
Japanese: 勇者になれなかった俺はしぶしぶ就職を決意しました。",NULL,"8.0000",NULL,"1388404113",NULL,"2013-10-06 08:29:40","2013-12-21 09:20:06","63335"
"430","3","Strike the Blood","strike-blood","2013/10/54273.jpg",NULL,"TV","On-going","2013-10-04","0000-00-00","a:1:{i:0;s:6:""Subbed"";}","PG-13 - Teens 13 or older","The Fourth Primogenitor—That's the world's strongest vampire that should only exist in legends. Accompanied by twelve Kenjuu and spreading calamity, this phantom vampire appeared in Japan. For the observation and obliteration of this Fourth Primogenitor, the government and Lion King decided to dispatch an attack mage known as a Sword Shaman. However, for some reason, the one chosen for the observation was a apprentice Sword Shaman girl, Himegari Yukina. Wielding the strongest anti-primogenitor spirit spear, Yukina arrived at Demon District, Itogami City. What is the true identity of the Fourth Primogenitor, Akatsuki Kojou, she encountered over there!?
 ","1","24","24",,"Japanese: ストライク・ザ・ブラッド",NULL,"0.0000",NULL,"0",NULL,"2013-10-06 08:39:01","2014-07-04 21:39:13","63370"
"431","3","Outbreak Company","outbreak-company","2013/10/54343.jpg",NULL,"TV","Complete","2013-10-04","2013-12-20","a:1:{i:0;s:6:""Subbed"";}","PG-13 - Teens 13 or older","Having a light novel author father and an eroge illustrator mother, Kanou Shinichi is a thoroughbred otaku. However he does not have any special power except for his broad knowledge, sharp insight, and impeccable instinct about ""MOE"" and its products, from manga to anime to games to light novel to figures. One day he found himself transported to a fantasy world where elves live and dragons fly. And he is given a task—not to fight monster or embark on a quest, but to enhance cultural exchange by becoming a ""moe missionary"" in this fantasy world! He meets a palace guard who has a bit of fujoshi taste, a half-elf maid, and the empress who is a little girl. He comes up with the idea of building a school. At first it runs as a comedy but later there are serious matters that Shinichi needs to face: ethnic discrimination, social problems, conflict with neighboring countries, sabotage by opposition elements including Japanese government, etc. Can he overcome the obstacles, successfully bring ""moe"" culture to the fantasy world, and help the people there as well?
 ","1","12","24",,"Japanese: アウトブレイク・カンパニー",NULL,"0.0000",NULL,"1390253589",NULL,"2013-10-06 08:46:41","2014-01-04 22:40:06","63400"
"432","3","Log Horizon","log-horizon","2013/10/54267.jpg",NULL,"TV","On-going","2013-10-05","0000-00-00","a:1:{i:0;s:6:""Subbed"";}","PG-13 - Teens 13 or older","The story begins when 30,000 Japanese gamers are trapped in the fantasy online game world Elder Tale. What was once a sword-and-sorcery world is now the real world. The main lead Shiroe attempts to survive with his old friend Naotsugu and the beautiful assassin Akatsuki.
 ","1","25","25",,"Japanese: ログ・ホライズン",NULL,"0.0000",NULL,"0",NULL,"2013-10-06 08:53:55","2014-07-04 21:30:34","63417"
"433","3","Freezing Vibration","freezing-vibration","2013/10/52089.jpg",NULL,"TV","Complete","2013-10-04","2013-12-20","a:1:{i:0;s:6:""Subbed"";}","R+ - Mild Nudity","Second season of Freezing.","1","12","25",,"Japanese: フリージング ヴァイブレーション",NULL,"6.0000",NULL,"1388311030",NULL,"2013-10-06 09:06:09","2014-02-15 08:33:40","63477"
"434","3","White Album 2","white-album-2","2013/10/53561.jpg",NULL,"TV","Complete","2013-10-06","2013-12-28","a:1:{i:0;s:6:""Subbed"";}","PG-13 - Teens 13 or older","Fall, when graduation is only half a year away.

Haruki Kitahara, the final member of the light music club that dissolved, plays his guitar by the window after school in preparation for the school festival. It was the one and only adventure of a good student who spent two diligent years on his studies.

But when a flowing piano melody and a voice as a clear as bell harmonize with his guitar… He goes from being alone, to being two, then three in the light music club, as the semester he dreamed of, no, hoped for, began.
 ","2","13","25",,"Synonyms: WHITE ALBUM2, WA2
Japanese: ホワイトアルバム2",NULL,"0.0000",NULL,"1392570439",NULL,"2013-10-06 09:12:59","2014-02-15 08:39:26","63508"
"435","11","Machine-Doll wa Kizutsukanai","machine-doll-wa-kizutsukanai","2013/10/MACHINE-DOLL-WA-KIZU.jpg",NULL,"TV","Complete","2013-10-07","2013-12-23","a:1:{i:0;s:6:""Subbed"";}","R+ - Mild Nudity","During the early 20th century, along with technological advancements, scientists were able to develop sophisticated magic. The combination of science and sorcery was Makinot, circuits made from spells that were put into objects to bring them to life and even gain a personality. It was developed as a military weapon and has now spread throughout the world.

Akabane Raishin is now attending the Royal Academy to become the best in the world. Accompanied by the lovely teenage girl Yaya, who is actually Raishin’s puppet weapon, he plans on rocketing to the top of the class. However, his test scores come nearly dead last although his combat skills and determination are second to none. Raishin has to compete with the deadliest of classmates if he wants to come out as the king.
","1","12","24","Unbreakable Machine-Doll","English: Unbreakable Machine-Doll
Synonyms: Machine Girl wa Kizutsukanai, Kikou Shoujo wa Kizutsukanai
Japanese: 機巧少女は傷つかない",NULL,NULL,NULL,NULL,NULL,"2013-10-08 00:42:25","2013-12-24 18:21:03","63556"
"436","11","Non Non Biyori","non-non-biyori","2013/10/NON-NON-BIYORI.jpg",NULL,"TV","Complete","2013-09-01","2013-12-23","a:2:{i:0;s:6:""Subbed"";i:1;s:6:""Dubbed"";}","PG-13 - Teens 13 or older","Elementary school student Hotaru Ichijou has moved with her parents from Tokyo to the middle of the country. Now she must adapt to her new school, where there are a total of 5 students in the same class who range through elementary and middle school ages. Join their everyday adventures in the countryside. 
","1","12","24",,,NULL,NULL,NULL,NULL,NULL,"2013-10-08 01:22:33","2013-12-24 18:28:50","63563"
"437","11","Aoki Hagane no Arpeggio: Ars Nova","aoki-hagane-arpeggio-ars-nova","2013/10/AOKI-NOVA.jpg",NULL,"TV","Complete","2013-10-08","2013-12-24","a:1:{i:0;s:6:""Dubbed"";}","PG-13 - Teens 13 or older","In the story, a Fleet of Fog loaded with super weapons suddenly appear all over the world. Without the ability to withstand this fleet, humanity was defeated and could no longer travel the seas. 17 years after the devastating naval war, Chihaya Gunzou and his friends somehow commandeer a Fleet of Fog submarine and rename it I-401. Together with Iona, they take on the Fleet of Fog.
","1","12","25",,,NULL,NULL,NULL,NULL,NULL,"2013-10-08 01:57:06","2013-12-24 18:27:48","63606"
"438","11","Yowamushi Pedal ","yowamushi-pedal","2013/10/PEDAL.jpg",NULL,"TV","On-going","2013-10-08","0000-00-00","a:2:{i:0;s:6:""Subbed"";i:1;s:6:""Dubbed"";}","PG-13 - Teens 13 or older","Otaku Sakamichi Onoda has just entered high school and plans to join the anime club. In middle school, Onoda didn’t have any friends with whom he could talk about anime, games, Akihabara and other otaku things, and he is hoping he can make such friends in the anime club, but he finds out it's been disbanded. In order to reestablish the club he tries to find 4 other people who would like to join.

Since he was a little boy, Onoda has ridden his mamachari—a bulky bicycle with a step-through frame mainly used for short rides, such as for casual fun or to pick up groceries—to go to Akihabara every week to check out or buy otaku things. Fellow freshman Shunsuke Imaizumi and bicyclist, while training, notices a boy (Onoda) riding his mamchari up a steep road.

Freshman and road racing cyclist, Shokichi Naruko visits Akihabara to get some Gundam plastic models for his younger brothers and meets Onoda who catches his attention because of the his cycling skill on the mamachari and later find out they go to the same school. Later on, both Naruko and Imaizumi try to convince him to join the bicycle racing club, but will he?
","1","38","25",,,NULL,NULL,NULL,NULL,NULL,"2013-10-08 02:12:25","2013-12-16 09:11:41","63634"
"439","11","Gundam Build Fighters","gundam-build-fighters","2013/10/GUNDAM-BUILD.jpg",NULL,"TV","On-going","2013-10-04","0000-00-00","a:2:{i:0;s:6:""Subbed"";i:1;s:6:""Dubbed"";}","G - All Ages","The story is set in the near future when GunPla Battles, competitions that pit Gundam plastic models against each other, have become popular worldwide in the ""Second GunPla Boom."" Sei Iori, a first-year middle-school student and the only son of a model shop owner, is talented at building GunPla, but inexperienced in the GunPla Battles. He encounters a mysterious boy named Reiji, who happens to be an accomplished Gundam Fighter. Together, they strive for the GunPla Battle world championships.

","1","12","25",,,NULL,NULL,NULL,NULL,NULL,"2013-10-08 02:21:51","2013-12-16 09:37:56","63642"
"440","11","Yozakura Quartet: Hana no Uta","yozakura-quartet-hana-uta","2013/10/Yozakura-Quartet-Hana-no-Uta.jpg",NULL,"TV","Complete","2013-10-07","2013-12-30","a:2:{i:0;s:6:""Subbed"";i:1;s:6:""Dubbed"";}","PG-13 - Teens 13 or older","In a town where humans and demons co-exist, it takes more than a normal police force to maintain the peace. Enter the Hiizumi Life Counseling Office, a fantastic foursome of unique teenagers, each gifted with an amazing super power!
","1","13","25",,,NULL,"10.0000",NULL,"1388389891",NULL,"2013-10-08 02:25:32","2013-12-31 23:26:47","63646"
"441","12","Mahou Tsukai ni Taisetsu na Koto","mahou-tsukai-ni-taisetsu-na-koto","2013/10/Mahou-Taukai-ni-Taisetsu-na-Koto.jpg",NULL,"TV","Complete","2003-01-10","2003-03-28","a:1:{i:0;s:6:""Subbed"";}","PG-13 - Teens 13 or older","Yume Kikuchi, a girl who can use magic, goes to Tokyo to be an apprentice mage to the handsome Masami Oyamada (a professional mage). In Tokyo, Yume learns about magic, helping people, and various other things on her way to being a mage. But she soon also finds out that even just magic alone isn't enough to make someone truly happy...
","1","12","24","Someday's Dreamers","English: Someday's Dreamers
Japanese: 魔法遣いに大切なこと",NULL,NULL,NULL,NULL,NULL,"2013-10-09 22:25:01","2013-10-09 22:33:24","63721"
"442","12","Onegai My Melody","onegai-melody","2013/10/Onegai-My-Melody.jpg",NULL,"TV","Complete","2005-04-30","2006-03-26","a:1:{i:0;s:6:""Subbed"";}","PG - Children","My Melody arrives on Earth much to the surprise of her rival Kuromi. Together with one of the junior high school students, Yumeno Uta, they decide to protect the dreams of the people with the help of magic. 
","1","52","24","Onegai My Melody","English: Onegai My Melody
Japanese: おねがいマイメロディ",NULL,NULL,NULL,NULL,NULL,"2013-10-10 14:29:13","2013-10-10 14:29:13","63818"
