"132","3","Bakugan Battle Brawlers: Gundalian Invaders","bakugan-battle-brawlers-gundalian-invaders","2012/03/Bakugan-Battle-Brawlers-Gundalian-Invaders.jpg",NULL,"TV","Complete","2010-05-23","2011-01-29","a:2:{i:0;s:6:""Subbed"";i:1;s:6:""Dubbed"";}","G - All Ages","Dan, Marucho, and Shun get caught up in a war between two different alien factions in another universe, and teaming up with three new brawlers: the Neathian, Fabia, the new human, Jake, and the Gundalian, Ren, in order to stop the evil Gundalian Protectors, the Twelve Orders from destroying Neathia, and possibly, Earth. They meet these people by them entering through the virtual reality Bakugan Interspace. The stakes are high! Will the Battle Brawlers triumph, saving the Bakugan once more?","3","39","24",NULL,"English: Bakugan: Gundalian Invaders
Japanese: 爆丸バトルブローラーズ Gundalian Invaders",NULL,NULL,NULL,NULL,NULL,"2012-03-21 05:07:15","2013-07-30 01:34:51","15841"
"133","3","Bakugan Battle Brawlers","bakugan-battle-brawlers","2012/03/bakugan-battle-brawlers.jpg",NULL,"TV","Complete","2007-04-05","2008-03-27","a:2:{i:0;s:6:""Subbed"";i:1;s:6:""Dubbed"";}","PG - Children","The Bakugan battle brawlers began when two young boys by the name of Dan and Shun made the rules to a mysterious game played with bakupearls, gate cards and ability cards. No one would ever have guessed what was going to happen next as Dan and his new internet friends battle their way to the bitter end.","1","52","24",NULL,"Japanese: 爆丸バトルブローラーズ",NULL,NULL,NULL,NULL,NULL,"2012-03-21 05:08:25","2013-07-30 01:38:08","15842"
"134","3","Baka to Test to Shoukanjuu","baka-to-test-to-shoukanjuu","2012/02/bakaToTestToShoukanjuu.jpg",NULL,"TV","Complete","2010-01-07","2010-04-01","a:2:{i:0;s:6:""Subbed"";i:1;s:6:""Dubbed"";}","PG-13 - Teens 13 or older","The story centers around Akihisa Yoshii, the ""baka"" of the title. His academy rigidly divides up the student body into classes based on the results of tests. The prodigies are in the A class with reclining seats complete with air conditioning, but Akihisa is in F class, the lowest rung of the school ladder which is furnished only with low, decrepit tables and worn-out straw tatami mats. A girl named Mizuki Himeji is actually one of the smartest girls in Akihisa's sophomore year, but she had a fever on test day and was pigeonholed into the F class. Besides Mizuki (who Akihisa secretly adores), the F class also has Yuuji Sakamoto, the class president who has been Akihisa's friend and partner-in-crime since the freshman year.

The school happens to have developed experiments to summon fantasy creatures, and Akihisa decides to rally F class to take on the higher-tiered classes and seize their perks. The F class uses the summoned creatures in an all-out battle for school supremacy.","1","13","24","Baka and Test - Summon the Beasts","English: Baka and Test - Summon the Beasts
Synonyms: The Idiot, the Tests, and the Summoned Creatures, Baka to Test to Shokanju, BakaTest
Japanese: バカとテストと召喚獣",NULL,"6.0000",NULL,"1388451122",NULL,"2012-03-21 05:10:14","2013-08-23 23:00:45","15845"
"135","3","Baccano!","baccano","2012/03/Baccano.jpg",NULL,"TV","Complete","2007-07-26","2007-11-01","a:2:{i:0;s:6:""Subbed"";i:1;s:6:""Dubbed"";}","R - 17+ (violence & profanity)","During the late 1930s in Chicago, the transcontinental train, Flying Pussyfoot, is starting its legendary journey that will leave a trail of blood all over the country. At the same time in New York, the ambitious scientist Szilard and his unwilling aide Ennis, are looking for missing bottles of the immortality elixir. In addition, a war between the mafia groups is getting worse. On board the Advena Avis, in 1711, alchemists are about to learn the price of immortality.

Based on the award winning light novels of the same name, this anime adaptation follows several events that initially seem unrelated, both in time and place, but are part of a much bigger story - one of alchemy, survival and immortality. Merging these events together are the kindhearted would-be thieves, Isaac and Miria, connecting various people, all of them with their own hidden ambitions and agendas, and creating lifelong bonds and consequences for everyone involved.","1","13","24",,"English: Baccano!
Japanese: バッカーノ！",NULL,NULL,NULL,NULL,NULL,"2012-03-21 05:10:53","2013-08-23 22:59:51","15848"
"136","3","Baby, Please Kill me!","baby-please-kill-me","2012/03/baby-please-kill-me.jpg",NULL,"TV","Complete","2012-01-06","2012-03-30","a:2:{i:0;s:6:""Subbed"";i:1;s:6:""Dubbed"";}","PG-13 - Teens 13 or older","Kill Me Baby is the touching story of Yasuna, a normal (?) high school girl, and Sonya, her best friend who happens to be an assassin. Unfortunately, little Sonya's trained assassin instincts often work against her and others in her daily high school life, as Yasuna's often-broken wrist can attest to. She just wanted a hug, but she ended up with a broken neck. Isn't it sad? No, it's hilarious.

Not even Yasuna's intense ninja training can prepare her for the exciting adventures in this explosive 4-panel manga adaptation.","1","13","24",,"English: Kill Me Baby!",NULL,NULL,NULL,NULL,NULL,"2012-03-21 05:14:12","2013-08-23 22:58:32","15849"
"137","3","Avatar The Last Airbender: Book 3","avatar-the-last-airbender-book-3","2012/03/AvatarB3V4.jpg",NULL,"TV","Complete","2007-09-21","2008-07-19","a:1:{i:0;s:6:""Dubbed"";}","PG-13 - Teens 13 or older","Aang recovers to find his allies disguised as Fire Nation soldiers on a Fire Nation ship, while Zuko has been restored to the position of crown prince and Iroh is imprisoned as a traitor. Sokka has planned a small-scale invasion of the Fire Nation to defeat Fire Lord Ozai, taking advantage of the solar eclipse, staged by various allies encountered in previous episodes. After initial success, the invasion ultimately fails, and only Aang, Sokka, Katara, and Toph escape. Zuko, in a change of heart, defies his father and decides to teach Aang Firebending; though it takes a while to make up for a year's worth of dogged pursuit, he eventually manages to prove his change of heart and is adopted wholeheartedly into the Avatar's party.
In the four-part series finale, Aang and his friends confront Fire Lord Ozai, who plans to use the power of Sozin's Comet to destroy the other nations and rule the world as the Phoenix King. Iroh, after breaking himself out of prison, leads the Order of the White Lotus (an international society of martial-arts masters, including himself and Aang's allies King Bumi, Master Pakku, Master Piando, and Jeong Jeong) to liberate Ba Sing Se. Sokka, Toph, and Kyoshi Warrior Suki disable the Fire Nation's airships, preventing them from burning down the Earth Kingdom, while Zuko challenges Azula. Initially, Zuko gains the advantage; but when Azula fires a lightning bolt at Katara, Zuko intercepts the bolt to save her, injuring himself in the process. Katara then restrains Azula and heals Zuko. Aang, contending with Ozai, is reluctant to kill him, and is able to overcome him by permanently stripping him of his Firebending. Zuko is crowned the new Fire Lord and, with the help of the Avatar and his friends, begins rebuilding the four nations. After Zuko is crowned he goes to confront his father in prison and demands the location of his banished mother. The team meets at Iroh's tea shop, the Jasmine Dragon, in Ba Sing Se to celebrate their victory. Aang and Katara kiss as the sun sets, ending the series.","3","21","23",,,NULL,"8.5714",NULL,"1405510188",NULL,"2012-03-21 05:14:18","2013-08-14 17:41:30","15852"
"138","3","Avatar The Last Airbender: Book 2","avatar-the-last-airbender-book-2","2012/03/Avatar_Book_2.png",NULL,"TV","Complete","2006-03-17","2006-12-01","a:1:{i:0;s:6:""Dubbed"";}","PG-13 - Teens 13 or older","After leaving the Northern Water Tribe, Aang masters Waterbending under Katara's tutelage. Searching for an Earthbending teacher, the group meets Toph Bei Fong, a blind Earthbending prodigy, and recruit her as such. Zuko and Iroh, now fugitives from the Fire Nation, attempt to lead new lives in the Earth Kingdom, where Zuko, with the help of his uncle, tries to let go of his troubled past and his obsession with capturing the Avatar. Aang and his friends discover that an upcoming solar eclipse will deprive Firebenders of their eponymous ability, leaving them open to invasion and giving Aang his chance to defeat the Fire Lord; but in learning this Aang's Sky Bison is lost to a group of Sandbenders. Azula and her two friends Mai and Ty Lee pursue the protagonists, who struggle to reach Ba Sing Se, the Earth Kingdom's capital, and tell the Earth King of the eclipse. Disguised as the Kyoshi Island Warriors (disciples of a previous Avatar), Azula persuades Ba Sing Se's secret police, the Dai Li, to instigate a revolution, allowing the Fire Nation to capture Ba Sing Se. Both Zuko and Katara are captured during the coup, and though Katara offers him redemption, Zuko sides with his sister. Aang attempts to activate the Avatar State, an act he had formerly avoided because it requires him to abandon his love for Katara, but Azula hits him with lightning as he powers up, killing him. Iroh, furious and disappointed in Zuko's choices, intercedes, allowing Katara to escape with Aang; she is able to revive him, but he can no longer re-enter the Avatar State, depriving him of one of his strongest weapons just as Ba Sing Se, the strongest bulwark against Fire Nation conquest, has fallen.","2","20","23",,,NULL,"8.1429",NULL,"1405508703",NULL,"2012-03-21 05:17:32","2013-08-14 17:39:57","15851"
"139","3","Avatar The Last Airbender: Book 1","avatar-the-last-airbender-book-1","2012/03/Avatar-Book-1.jpg",NULL,"TV","Complete","2005-02-21","2005-12-02","a:1:{i:0;s:6:""Dubbed"";}","PG-13 - Teens 13 or older","Katara, a fourteen-year-old Waterbender girl, and her brother the fifteen-year-old Sokka, find Aang and Appa in the iceberg. After Aang is revealed to be the Avatar, the three travel to the Northern Water Tribe from whom Aang and Katara can learn Waterbending. En route Aang and friends visit the Southern Air Temple, where Aang discovers the genocide of his people and encounters the spirit of his predecessor Avatar Roku. Throughout their journey, the trio are pursued by Prince Zuko, the exiled son of Fire Lord Ozai, who seeks to reclaim his honor by capturing the Avatar. Zuko travels with his uncle Iroh, a legendary Fire Nation general and the older brother of Ozai. Competing with Zuko for the Avatar is Admiral Zhao, who leads an attack on the Northern Water Tribe. Zhao's rather megalomaniacal attack plans, which include slaying the physical incarnation of the Moon Spirit and wreaking havoc on the entire world, are stopped by Aang and his friends, with assistance from Iroh and Zuko. As such, the Fire Lord orders his daughter Azula to capture Zuko and Iroh, who are now considered traitors to the Fire Nation.","1","20","23",,,NULL,"8.2857",NULL,"1405526315",NULL,"2012-03-21 05:18:08","2013-08-14 17:38:45","15850"
"140","3","Aoi Bungaku Series","aoi-bungaku-series","2012/03/Aoi-Bungaku.jpg",NULL,"TV","Complete","2009-10-11","2009-12-27","a:1:{i:0;s:6:""Subbed"";}","R - 17+ (violence & profanity)","The series consists of adaptations of six modern classics of Japanese literature: Osamu Dazai’s No Longer Human (Ningen Shikkaku) & Run, Melos! (Hashire, Melos!), Natsume Soseki’s Kokoro, Ryunosuke Akutagawa’s Hell Screen (Jigoku Hen) & The Spider's Thread (Kumo no Ito), and Ango Sakaguchi's In the Forest, Under Cherries in Full Bloom (Sakura no Mori no Mankai no Shita).

No Longer Human (Ningen Shikkaku) - A high school student becomes lost and alienated. Despondent and aimless, he falls into a cycle of self abuse, depression and drugs that taints his life for years. Told in three chapters, each chapter deals with a different point in his life and the final chapter leaves him standing alone - an empty and hollow charicature of his former self.","1","12","22","Blue Literature","English: Blue Literature
Japanese: 青い文学シリーズ",NULL,NULL,NULL,NULL,NULL,"2012-03-21 05:19:20","2013-08-14 17:36:51","15853"
"141","3","Ao No Exorcist","ao-no-exorcist","2012/03/Ao-no-Exorcist.jpg",NULL,"TV","Complete","2011-04-17","2011-10-02","a:2:{i:0;s:6:""Subbed"";i:1;s:6:""Dubbed"";}","PG-13 - Teens 13 or older","This world consists of two dimensions joined as one, like a mirror. The first is the world in which the humans live, Assiah. The other is the world of demons, Gehenna. Ordinarily, travel between the two, and indeed any kind of contact between the two, is impossible. However the demons can pass over into this world by possessing anything that exist within it. Satan the god of demons, but there's one thing that he doesn't have, and that's a substance in the human world that is powerful enough to contain him!! For that purpose he created Rin, his son from a human woman, but will his son agree to his plans? Or will he become something else...? An exorcist?","1","25","24","Blue Exorcist","English: Blue Exorcist
Synonyms: Ao no Futsumashi
Japanese: 青の祓魔師(エクソシスト)",NULL,"7.0132",NULL,"1405431668",NULL,"2012-03-21 05:20:21","2013-08-14 17:35:33","15854"
"142","3","Ano Hi Mita Hana no Namae wo Bokutachi wa Mada Shiranai","ano-hi-mita-hana-no-namae-wo-bokutachi-wa-mada-shiranai","2012/02/Anohana.jpg",NULL,"TV","Complete","2011-04-15","2011-06-24","a:1:{i:0;s:6:""Subbed"";}","PG-13 - Teens 13 or older","A group of childhood friends drifts apart after one of them, Meiko ""Menma"" Honma, dies in an accident. Years later, the leader of the group, Jinta Yadomi, has become withdrawn and lives as a recluse. An older Meiko appears to him, and says that she must have a wish granted, though she does not know what it is.","1","11","22","Anohana: The Flower We Saw That DayO","English: anohana: The Flower We Saw That Day
Synonyms: AnoHana, We Still Don't Know the Name of the Flower We Saw That Day.
Japanese: あの日見た花の名前を僕達はまだ知らない。",NULL,"9.3333",NULL,"1405206233",NULL,"2012-03-21 05:21:00","2014-01-18 16:44:29","15861"
"143","3","Ano Natsu de Matteru","ano-natsu-de-matteru","2012/03/Ano-Natsu-de-Matteru.jpg",NULL,"TV","Complete","2012-01-10","2012-03-27","a:1:{i:0;s:6:""Subbed"";}","PG-13 - Teens 13 or older","When a group of friends decide to make a movie over a long summer holiday, they end up learning a little about filmmaking and a lot more about each other and themselves. What begins as a simple way to avoid the summer doldrums quickly turns into something much more complex, intimate and revealing, as the maturing relationships between the members of the young cast take on new, and sometimes very unexpected, turns.","1","12","23","Waiting in the Summer","English: Waiting in the Summer
Japanese: あの夏で待ってる",NULL,NULL,NULL,NULL,NULL,"2012-03-21 05:21:55","2013-08-14 17:31:13","15860"
"144","3","Air Gear","air-gear","2012/03/Air-Gear.jpg",NULL,"TV","Complete","2006-04-04","2006-09-26","a:2:{i:0;s:6:""Subbed"";i:1;s:6:""Dubbed"";}","R+ - Mild Nudity","Minami Itsuki never thought about seriously riding Air Treck motorized roller blades, until he got his butt handed to him by a street gang of Storm Riders. That day, he discovered in a locked up room, a pair of AT's and a box of stickers belonging to the Sleeping Forest street gang. One thing leads to another, and Ikki dons the wheels and begins to ride. As his reputation builds in the AT street fighting/racing world, he begins to develop his own gang and participate in more fights, gaining more and more territory.","1","25","24",,"English: Air Gear
Japanese: エア・ギア",NULL,"8.0000",NULL,"1388458599",NULL,"2012-03-21 05:22:30","2013-08-14 17:06:02","15864"
"145","3","A Channel","a-channel","2012/02/AChannel.jpg",NULL,"TV","Complete","2011-04-08","2011-06-24","a:1:{i:0;s:6:""Subbed"";}","PG-13 - Teens 13 or older","The story revolves around the everyday life of four high school girls: the flighty Run, the reckless Tooru, the timid Yuuko, and the level-headed Nagi.","1","12","24",,"Synonyms: A-Channel: The Animation
Japanese: Aチャンネル",NULL,NULL,NULL,NULL,NULL,"2012-03-21 05:23:33","2013-08-14 16:57:19","15862"
"146","3",".hack//Roots","hackroots","2012/03/hack-roots.jpg",NULL,"TV","Complete","2006-04-05","2006-09-27","a:2:{i:0;s:6:""Subbed"";i:1;s:6:""Dubbed"";}","PG-13 - Teens 13 or older","After the destruction of ""The World"" in 2015, CC Corporation rebuilt the game using data from what was previously to be another game. ""The World R:2"" was then released in 2016. A newcomer to the game, Haseo, is instantly PKed and then revived by a mysterious man known as Ovan. With the problem of PKs occupying the game, Haseo soon after receives help from a female Harvest known as Shino. Amidst curiosity and confusion, Haseo is lead to joining the guild known as the Twilight Brigade. The guild that searches for the legendary object known as the ""Key of the Twilight"". Set before the .hack//G.U. game.","1","26","24",NULL,"English: .hack//roots",NULL,NULL,NULL,NULL,NULL,"2012-03-21 05:24:24","2013-07-30 04:09:26","15863"
"147","3",".hack// Legend of The Twilight Bracelet","hack-legend-of-the-twilight-bracelet","2012/03/hack-Legend-of-the-Twilight-Bracelet.jpg",NULL,"TV","Complete","2003-01-08","2003-03-26","a:2:{i:0;s:6:""Subbed"";i:1;s:6:""Dubbed"";}","PG-13 - Teens 13 or older","Winning the legendary characters “Kite” and “Black Rose” from an event held by the creators of the MMORPG ‘The World,’ Shugo and his twin sister Rena steps into ‘The World’. Together they completed events and quests, along with their new friends Ouka, Mirelle, Hotaru and Sanjuro. Soon after, mysterious monsters appeared, and death by these monsters caused players to slip into a coma in the real world. Only Shugo and Rena can solve this problem, but why are they being targeted, and what secrets is the game hiding?","1","12","23",,"English: .hack//Legend Of The Twilight
Synonyms: .hack//Tasogare no Udewa Densetsu, .hack//Udeden, .hack//Legend of the Twilight Bracelet, .hack//DUSK
Japanese: .hack//黄昏の腕輪伝説",NULL,"6.0000",NULL,"1388568862",NULL,"2012-03-21 05:25:08","2013-08-14 16:54:06","15865"
"148","3","Digimon Adventure","digimon-adventure","2012/03/Digimon-Adventure.jpg",NULL,"TV","Complete",NULL,NULL,"a:2:{i:0;s:6:""Subbed"";i:1;s:6:""Dubbed"";}","PG-13 - Teens 13 or older","Seven kids are transported to the Digital World, a strange place where digital creatures called ""Digimon"" reside. A group of Digimon soon befriend them and keep the kids out of harm's way. The children then discover they are the Chosen Children, which protect the Digital World from evil Digimon like Devimon and Vamdemon.",NULL,"54","23",NULL,"English: Digimon: Digital Monsters
Synonyms: Digimon Adventure 01
Japanese: デジモンアドベンチャー",NULL,"7.0000",NULL,"1388543094",NULL,"2012-03-26 12:50:19","2013-04-18 19:26:13","16027"
"149","3","Another","another","2012/03/Another.jpg",NULL,"TV","Complete","2012-01-10","2012-03-27","a:1:{i:0;s:6:""Subbed"";}","R - 17+ (violence & profanity)","26 years ago, in a third-year classroom of a middle school, there was a student named Misaki. As an honors student who was also good at sports, the charming boy was popular with his classmates. When he suddenly died, his classmates decided to carry on as if he was still alive until graduation. Then, in the spring of 1998, a boy named Sakakibara Kouichi transfers to the class, and he grows suspicious of the fearful atmosphere in that classroom. In particular, there is a beautiful, aloof girl named Mei Misaki who wears an eyepatch and is always alone drawing pictures.","1","12","24",,"Japanese: アナザー",NULL,"7.0000",NULL,"1388346455",NULL,"2012-03-27 05:05:30","2013-08-14 17:34:33","16033"
"150","3","Amagami SS","amagami-ss","2012/03/amagamiSS.jpg",NULL,"TV","Complete","2010-07-02","2010-12-24","a:1:{i:0;s:6:""Subbed"";}","PG-13 - Teens 13 or older","Two years ago, Tachibana Junichi got his heart broken by a girl who didn't show up for a date on Christmas Eve. Now a second year student in high school, Junichi spends his days inside his closet planetarium, going to school and hanging out with his friends Tanamachi Kaoru and Umehara Masayoshi.

After a chance encounter with one of the most beautiful girls in school, the third year student Morishima Haruka, Junichi finds himself spending time with her, carrying books for her or having her unexpectedly jump on his back and act as she's a jockey and he's her horse. Soon enough, Junichi becomes romantically interested in Haruka which leads to...

Amagami SS is based on a PS2 dating game featuring six different girls. The story of the anime will be arranged in an omnibus format, with each heroine getting her own version of the story animated. Each heroine will sing her own version of the ending theme song.","1","25","24",,"English: Amagami SS
Japanese: アマガミSS",NULL,"10.0000",NULL,"1388550599",NULL,"2012-03-27 14:32:31","2013-08-14 17:24:36","16148"
"151","3","Avatar: The Legend of Korra Book 1","avatar-the-legend-of-korra-book-1","2012/03/avatar-korra.jpg",NULL,"TV","Complete","2012-04-14","2012-06-23","a:1:{i:0;s:6:""Dubbed"";}","PG-13 - Teens 13 or older","Avatar: The Legend of Korra picks up 70 years after Avatar: The last Airbender left off. This series is said to be much shorter but also more mature, than the last airbender.
Korra, a girl appearing to be in her late teens assumes the role of the avatar, a born waterbender now with the powers Water, Earth and Fire mastered she seeks an master airbender to complete her training.
Her Quest to find a master brings her to Republic city, a steampunk metropolis where people of all nations live together and thrive.

However, Korra quickly discovers that beneath the beauty of the city lies the underbelly of crime as well as a growing anti-bending revolution that threatens to tear republic city apart.
Under the Tutelage of Aang and Katara's son Tenzin she begins her airbending training while contesting the dangers at large. She also gets help from the former Avatar Aang, her spiritual guide, to teach her air bending and give her general support.","1","12","23",,,NULL,"7.6000",NULL,"1388825580",NULL,"2012-03-31 05:04:59","2013-08-18 02:03:21","15757"
"152","3","Kimi To Boku","kimi-to-boku","2012/04/Kimi-to-Boku.jpg",NULL,"TV","Complete",NULL,NULL,"a:1:{i:0;s:6:""Subbed"";}","PG-13 - Teens 13 or older","The story revolves around four teens — the good-looking twins Yuuta and Yuuki Asaba, the effeminate Shun Matsuoka, and the class head Kaname Tsukahara — who have known each other since early childhood. While they are not necessarily good or bad friends, they continue to hang out well into high school. The half-Japanese transfer student Chizuru Tachibana joins the circle of friends in this comedy about the everyday life of adolescence.",NULL,"13","25",NULL,"Synonyms: You and Me
Japanese: 君と僕。
",NULL,NULL,NULL,NULL,NULL,"2012-04-03 13:13:05","2013-04-18 05:05:32","16616"
"153","3","Kimi to Boku Season 2","kimi-to-boku-season-2","2012/04/Kimi-to-Boku-2.jpg",NULL,"TV","Complete",NULL,NULL,"a:2:{i:0;s:6:""Subbed"";i:1;s:6:""Dubbed"";}","PG-13 - Teens 13 or older","""No matter how many years go by, I'm sure we'll still be laughing together."" 

Twins Yuta and Yuki, Kaname, and Shun have been childhood friends since kindergarten. When transfer student Chizuru joins them, their five man school life becomes all the more lively. Through the changing seasons, the boys will find laughter, surprises, love, and new encounters waiting for them. 

The second season of the boys growing a little every day of their invaluable daily lives is about to begin! ",NULL,"13","25",NULL,"English: You and Me 2
Synonyms: You and Me. Second Season, Kimi to Boku. 2nd Season
Japanese: 君と僕。2",NULL,NULL,NULL,NULL,NULL,"2012-04-03 13:26:54","2013-04-18 05:08:31","16644"
"154","3","Kore wa Zombie Desu ka? of The Dead","kore-wa-zombie-desu-ka-of-the-dead","2012/04/Kore-wa-Zombie-Desu-ka-of-the-Dead.jpg",NULL,"TV","Complete",NULL,NULL,"a:2:{i:0;s:6:""Subbed"";i:1;s:6:""Dubbed"";}","R - 17+ (violence & profanity)","Aikawa Ayumu was revived as a zombie by the cute necromancer Eucliwood Hellscythe. After the zany, madcap adventures in the first season of Is This a Zombie? ended, Ayumu thought his life might finally get back to normal, or as normal as it can be for a zombie. However, destiny has other plans for him. Some guys just can't catch a break.",NULL,"0","23",NULL,"English: Is this A Zombie? of the Dead
Synonyms: Kore wa Zombie Desu ka? 2, Koreha Zombie Desu ka? Jigokuhen, Kore ha Zombie Desu ka? Jigokuhen, Kore wa Zombie Desu ka? Jigokuhen, Kore wa Zombie Desuka? of the Dead
Japanese: これはゾンビですか? OF THE DEAD",NULL,NULL,NULL,NULL,NULL,"2012-04-11 08:19:08","2013-04-18 05:15:56","16818"
