"260","1","Ore no Imouto ga Konnani Kawaii Wake ga Nai Season 2","ore-no-imouto-ga-konnani-kawaii-wake-ga-nai-season-2","2013/04/Ore-no-Imouto-ga-Konnani-Kawaii-Wake-ga-Nai.-Season-2.jpg",NULL,"TV","Complete","2013-04-07","2013-06-30","a:1:{i:0;s:6:""Subbed"";}","PG-13 - Teens 13 or older","Second season of OreImo (Ore no Imouto ga Konnani Kawaii Wake ga Nai).

Kyousuke Kousaka is a high school boy living an average, quiet life, but it all takes a sudden change when his little sister Kirino asks him for advice.

Kirino has a popular and fulfilling life, but the truth is that she loves anime, games, and other otaku interests.

Kyousuke answers her request for advice seriously, and the frozen relationship they shared begins to thaw from the resulting encounters with Kuroneko and Saori Vageena, two girls they meet through a SNS, conflicts with Kirino's best friends, Ayase and Kanako, and help from Kyousuke's childhood friend, Manami.

Now that the latest issue involving Kirino's study abroad is over, what kind of events will her “advice” bring up next?","2","13","24","OreImo Season 2","English: OreImo Season 2
Synonyms: My Little Sister Can't Be This Cute 2, Ore no Imouto ga Konna ni Kawaii Wake ga Nai 2
Japanese: 俺の妹がこんなに可愛いわけがない。",NULL,"9.0000",NULL,"1388451531",NULL,"2013-04-21 17:33:19","2013-07-30 10:24:44","41111"
"261","1","Yahari Ore no Seishun Love Come wa Machigatteiru.","yahari-ore-no-seishun-love-come-wa-machigatteiru","2013/04/Yahari-Ore-no-Seishun-Love-Come-wa-Machigatteiru..jpg",NULL,"TV","Complete","2013-04-05","2013-06-28","a:1:{i:0;s:6:""Subbed"";}","PG-13 - Teens 13 or older","This romantic comedy revolves around an antisocial high school student named Hikigaya Hachiman with a distorted view on life and no friends or girlfriend. When he see his classmates talking excitedly about living their adolescent lives, he mutters, They're a bunch of liars. When he is asked about his future dreams, he responds, Not working. A teacher gets Hachiman to join the volunteer service club, which happens to have the school's prettiest girl, Yukinoshita Yukino.
","1","13","24",,"English: My Teen Romantic Comedy SNAFU
Synonyms: Oregairu, My youth romantic comedy is wrong as I expected.
Japanese: やはり俺の青春ラブコメはまちがっている。",NULL,NULL,NULL,NULL,NULL,"2013-04-22 04:12:08","2013-08-20 17:38:03","41124"
"262","1","School Days","school-days","2013/04/School-Days.jpg",NULL,"TV","Complete","2007-07-03",NULL,"a:1:{i:0;s:6:""Subbed"";}","R+ - Mild Nudity","Makoto Ito is a young Japanese high school student beginning his second term at the fictional Sakakino Academy. During his daily train rides to and from school, he becomes infatuated with fellow student Kotonoha Katsura; a girl that also commutes. When a new classmate acquaintance of his, Sekai Saionji, discovers his secret crush on Kotonoha, she helps introduce both of them to each other and over time they grow closer and agree to date. However in spite of her proud and triumphant matchmaking efforts, Sekai inadvertently becomes jealous of the new couple, having also developed feelings toward Makoto.

The following afternoon on her way home at the nearby train station in front of the school, Sekai finds Makoto waiting for Kotonoha to rendezvous for a date. He sits with her and reiterates his appreciation for her help, and feeling heavily indebted, offers repayment anyway he can. Though she believes he is overreacting, Sekai decides to redeem her obligation by placing a kiss on his lips as her train pulls in; quickly rushing into an open passenger car and happily bidding a dumbstruck Makoto luck on his date.
",NULL,"12","25",NULL,"Japanese: スクールデイズ",NULL,"3.7143",NULL,"1404955919",NULL,"2013-04-23 20:15:28","2013-04-23 20:15:28","41234"
"263","1","Full Metal Panic!","full-metal-panic","2013/04/Full-Metal-Panic.jpg",NULL,"TV","Complete","2002-01-08",NULL,"a:2:{i:0;s:6:""Subbed"";i:1;s:6:""Dubbed"";}","R - 17+ (violence & profanity)","Sousuke Sagara, a seventeen year old military specialist working for the secret organization MITHRIL, has been assigned to protect the latest ""Whispered"" candidate Kaname Chidori. To complete this task Sousuke will have to deal with enemies from his past as well as the occasional panty thief. Unfortunately for Sousuke, the toughest part of his mission isn't only protecting Miss Chidori but also getting used to living an average High School students life, no easy task for someone raised on the battlefield.",NULL,"24","24",NULL,"English: Full Metal Panic!
Synonyms: FMP
Japanese: フルメタル パニック！",NULL,NULL,NULL,NULL,NULL,"2013-04-23 20:41:13","2013-04-23 20:41:13","41262"
"264","1","Full Metal Panic! The Second Raid","full-metal-panic-the-second-raid","2013/04/Full-Metal-Panic-The-Second-Raid.jpg",NULL,"TV","Complete","2005-07-13","0000-00-00","a:2:{i:0;s:6:""Subbed"";i:1;s:6:""Dubbed"";}","R+ - Mild Nudity","This series is set about two months after the events ocurred in the Tuatha de Danaan at the end of the original series. Mithril becomes aware of a secret organization that has technology able to counter the ECS (Electronic Cloaking System) mode. This organization, known as Amalgam, also has ""Black Technology"", obtained from ""Whispered"" like Kaname Chidori, and like the other intelligency agencies, they intend to obtain more. However, when Sousuke's mission to protect Chidori is terminated by Mithril, all seems to be in place for Amalgam's plans... Like many of its fans know, it is based of the FMP novel ""The End of Day by Day.""","1","13","24",,"English: Full Metal Panic! The Second Raid
Synonyms: Full Metal Panic! TSR
Japanese: フルメタル パニック！The Second Raid",NULL,"8.0000",NULL,"1389108494",NULL,"2013-04-23 20:44:30","2013-12-29 05:33:27","41264"
"265","1","Full Metal Panic? Fumoffu","full-metal-panic-fumoffu","2013/04/Full-Metal-Panic-Fumoffu.jpg",NULL,"TV","Complete","2003-08-26",NULL,"a:2:{i:0;s:6:""Subbed"";i:1;s:6:""Dubbed"";}","PG-13 - Teens 13 or older","It's back-to-school mayhem with Kaname Chidori and her war-freak classmate Sousuke Sagara as they encounter more misadventures in and out of Jindai High School. But when Kaname gets into some serious trouble, Sousuke takes the guise of Bonta-kun - the gun-wielding, butt-kicking mascot. And while he struggles to continue living as a normal teenager, Sousuke also has to deal with protecting his superior officer Teletha Testarossa, who has decided to take a vacation from Mithril and spend a couple of weeks as his and Kaname's classmate.",NULL,"12","24",NULL,"English: Full Metal Panic? Fumoffu
Synonyms: Full Metal Panic Fumoffu
Japanese: フルメタル・パニック? ふもっふ",NULL,NULL,NULL,NULL,NULL,"2013-04-23 20:53:22","2013-04-23 20:53:22","41269"
"266","1","Kimi ga Nozomu Eien","kimi-ga-nozomu-eien","2013/04/Kimi-ga-Nozomu-Eien.jpg",NULL,"TV","Complete","2003-10-05",NULL,"a:2:{i:0;s:6:""Subbed"";i:1;s:6:""Dubbed"";}","R+ - Mild Nudity","At first, Takayuki Narumi is befriended by Mitsuki Hayase only because Mitsuki's best friend, Haruka Suzumiya has a crush on him; however since then, Takayuki, his pal Shinji Taira, and Mitsuki have grown to be the best of friends. Then one day, Haruka confesses to Takayuki her love for him. Not wanting to hurt her feelings, Takayuki agrees to go out with her. After a few incidents, their relationship gets intimate, even while Takayuki and Mitsuki begin to realize their feelings for each other. But suddenly, when tragedy strikes, things are never the same for these four friends again. 
",NULL,"14","23",NULL,"English: Rumbling Hearts
Synonyms: The Eternity You Wish For, KimiNozo
Japanese: 君が望む永遠",NULL,NULL,NULL,NULL,NULL,"2013-04-25 01:44:19","2013-04-25 01:51:00","41643"
"267","2","Druaga no Tou: The Aegis of Uruk","druaga-no-tou-the-aegis-of-uruk","2013/04/the-Aegis-of-URUK.jpg",NULL,"TV","Complete","2008-04-01",NULL,"a:2:{i:0;s:6:""Subbed"";i:1;s:6:""Dubbed"";}","PG-13 - Teens 13 or older","It is said that every few years, there is what's known as the ""Summer of Anu."" During that summer, thanks to the divine protection of the sky-god Anu, all of the demons in the tower lose their power. The country of Uruk has begun an invasion of the tower in order to suppress the demons. They've built up positions inside the tower, with their sights set on getting to the upper levels. The Uruk army knows that this is the third Summer of Anu-a perfect time to launch a mission to suppress the monster Druaga once and for all. The army soldiers aren't the only ones in the tower, though. An enitre city called Meskia has formed inside the tower's first floor. It plays host not just to soldiers, but also to adventurers who have heard rumors about a legendary treasure called the Blue Crystal Rod, which is said to rest at the very top of the tower. With all these different groups in the mix, each with its own agenda, one can only guess how things will play out during this unusual summer.",NULL,"12","25",NULL,"English: Tower of Druaga: The Aegis of Uruk
Japanese: ドルアーガの塔 〜the Aegis of URUK〜",NULL,NULL,NULL,NULL,NULL,"2013-04-25 16:20:02","2013-04-25 17:26:41","41865"
"268","2","Druaga no Tou: The Sword of Uruk","druaga-no-tou-the-sword-of-uruk","2013/04/Druaga-no-Tou-The-Sword-of-Uruk.jpg",NULL,"TV","Complete","2009-01-08",NULL,"a:2:{i:0;s:6:""Subbed"";i:1;s:6:""Dubbed"";}","PG-13 - Teens 13 or older","With broken spirits and enigmatic questions that hold no answers lingering, Jil is still trying to figure everything out. Then, a mysterious girl named Kai appears before him and says: “Take me to the top of the tower.”

Kai’s request shrouded in ambiguity, Jil will have another chance to work towards completing his destiny and ascend the Tower. With his hopes and aspirations seemingly slipping out of his hands, Jil must rise to the challenge once again on this never-ending adventure.",NULL,"12","25",NULL,"English: Tower of Druaga: The Sword of Uruk
Japanese: ドルアーガの塔 ～the Sword of URUK～",NULL,NULL,NULL,NULL,NULL,"2013-04-25 17:26:18","2013-04-25 17:26:18","41931"
"269","3","Sora no Manimani","sora-no-manimani","2013/04/SoranoManimani.jpg",NULL,"TV","Complete","2009-07-07",NULL,"a:1:{i:0;s:6:""Subbed"";}","PG-13 - Teens 13 or older","Saku Ooyagi returns to his hometown after seven years and is soon reacquainted with his childhood friend, Mihoshi Akeno. The reunion is far from merry since the last memory they have of each other is of her falling off a tree and him saving her. In any case, Mihoshi is determined to improve their relationship and forces Saku to join the astronomy club she founded.
",NULL,"12","23",NULL,"English: At The Mercy of The Sky
Synonyms: Chuu no Manimani
Japanese: 宙のまにまに

",NULL,NULL,NULL,NULL,NULL,"2013-04-28 02:58:11","2013-04-28 03:08:46","42784"
"270","2","RDG: Red Data Girl","rdg-red-data-girl","2013/04/RDG-Red-Data-Girl.jpg",NULL,"TV","Complete","2013-03-16",NULL,"a:1:{i:0;s:6:""Subbed"";}","PG-13 - Teens 13 or older","A modern fantasy based on Japanese Shinto legends. Suzuhara Izumiko is a 15-year-old girl, who has been raised and protected in a shrine deep in the Kumano mountains. She is quite shy and destroys all the electric devices she touches. When she begins to think about going out of the mountains and moving to the city, her guardian Sagara Yukimasa recommends her to enter a high school in Tokyo and forces his son Miyuki to serve Izumiko for life. Miyuki and Izumiko repel each other but their relationship begins to change when a terrifying accident occurs on the school excursion. Izumiko learns her fate as the last representative (yorishiro) of a Himegami goddess and Miyuki learns of his duty as a guardian Yamabushi of Izumiko. 
",NULL,"12","24",NULL,"English:  Red Data Girl
Japanese:  RDG レッドデータガール",NULL,NULL,NULL,NULL,NULL,"2013-04-29 04:11:58","2013-05-06 14:50:31","43088"
"271","3","Senkou no Night Raid","senkou-no-night-raid","2013/04/Senkou-no-Night-Raid.jpg",NULL,"TV","Complete","2010-06-25",NULL,"a:1:{i:0;s:6:""Subbed"";}","R - 17+ (violence & profanity)","The year is 1931. The city is Shanghai. Ten years before America will enter World War II, the hydra's teeth planted by the first great global conflict are beginning to germinate. Hatching like spiders, they weave the complex web of plots and conspiracies destined to inevitably draw entire nations to the brink of destruction. Caught in the heart of these webs, desperately seeking to separate lies from truth, is ""Sakurai Kikan,"" an ultra-secret intelligence agency staffed by extraordinarily talented individuals with abilities far beyond those of normal humans. Their duty: to stop the darkest plots and eliminate the greatest threats. But in a city built on intrigue, can even a team of clairvoyants, telepaths and espers stand against the ultimate forces of destiny?
Read more at http://myanimelist.net/anime/6973/Senkou_no_Night_Raid#ky1qeOxCjuCyLlss.99 ",NULL,"14","23",NULL,"English: Night Raid 1931
Japanese: 閃光のナイトレイド",NULL,NULL,NULL,NULL,NULL,"2013-04-29 14:34:15","2013-04-29 14:34:15","43125"
"272","2","Byousoku 5 Centimeter","byousoku-5-centimeter","2013/05/Byousoku-5-Centimeter.jpg",NULL,"Movie","Complete","2007-02-11","2007-03-03","a:2:{i:0;s:6:""Subbed"";i:1;s:6:""Dubbed"";}","PG-13 - Teens 13 or older","Tohno Takaki and Shinohara Akari, two very close friends and classmates, are torn apart when Akari's family is transferred to another region of Japan due to her family's job. Despite separation, they continue to keep in touch through mail. When Takaki finds out that his family is also moving, he decides to meet with Akari one last time.

As years pass by, they continue down their own paths, their distance slowly growing wider and their contact with one another fades. Yet, they keep remembering one another and the times they have shared together, wondering if they will have the chance to meet once again.","1","3","22",,"English:  Five Centimeters Per Second
Japanese: 秒速５センチメートル",NULL,NULL,NULL,NULL,NULL,"2013-05-01 10:08:32","2013-08-23 23:16:23","43213"
"273","2","Sunabouzu: Desert Punk","sunabouzu-desert-punk","2013/05/desert-punk.jpg",NULL,"TV","Complete","2004-10-06","2005-03-30","a:2:{i:0;s:6:""Subbed"";i:1;s:6:""Dubbed"";}","R - 17+ (violence & profanity)","In the future, Japan is a wasteland. In the Great Kantou Desert, scattered humans eke out a living in the hot sand. Among them, a short-statured man they call ""Sunabouzu"" makes a living as a bounty hunter. Like a demon of the sand, he seems unbeatable. Yet, like all men, he has a particular weakness for the opposite sex..
","1","24","24",,"English: Desert Punk
Japanese: 砂ぼうず  Sunabozu",NULL,NULL,NULL,NULL,NULL,"2013-05-01 12:41:55","2013-08-25 23:29:09","43228"
"274","2","Devil Survivor 2 The Animation","devil-survivor-2-the-animation","2013/05/Devil-Survivor-2.jpg",NULL,"TV","Complete","2013-04-05","2013-06-28","a:1:{i:0;s:6:""Subbed"";}","PG-13 - Teens 13 or older","When the world is under attack by a monstrous and seemingly unstoppable enemy, the only way to fight back is with warriors who have already died! Sidestepping a gruesome fate in a subway crash during an earthquake, two young men and a girl find themselves recruited into the ranks of the Devil Summoners and given the ability to literally call up demons to battle against the mysterious Septentrione! Can Hibiki, Daichi and Io survive in a war where demons face demons under human command? Where a person's death can be seen in advance? Where every living being is just a game piece to be saved or expended? And where each clash comes with a clock counting down to Armageddon? Get ready to be immersed in the ultimate conflict between good and evil as the living, the dead and the demonic combine forces to send the invaders straight back to Hell in DEVIL SURVIVOR 2 THE ANIMATION!","1","13","24",,"English: Devil Survivor 2 The Animation
Japanese: デビルサバイバー２ THE ANIMATION",NULL,NULL,NULL,NULL,NULL,"2013-05-02 22:33:27","2013-08-04 06:24:19","43415"
"275","2","Hentai Ouji to Warawanai Neko.","hentai-ouji-to-warawanai-neko","2013/05/Hentai-Ouji-to-Warawanai-Neko..jpg",NULL,"TV","Complete","2013-04-14","2013-06-29","a:1:{i:0;s:6:""Subbed"";}","PG-13 - Teens 13 or older","Youto Yokodera is always thinking about his carnal desires, but no one acknowledges him as a pervert. He learns about a cat statue that supposedly grants wishes. The boy goes to pray that he will be able to express his lustful thoughts whenever and wherever he wants. At the statue, Youto encounters Tsukiko Tsutsukakushi, a girl from his high school with her own wish—that she would not display her real intentions so readily.","1","12","24","The ""Hentai"" Prince and the Stony Cat","English: The ""Hentai"" Prince and the Stony Cat
Japanese: Hentai Ouji to Warawanai Neko.",NULL,"9.0000",NULL,"1388499348",NULL,"2013-05-03 16:30:08","2013-08-18 04:01:39","43471"
"276","2","Photokano","photokano","2013/05/Photokano.jpg",NULL,"TV","Complete","2013-04-05",NULL,"a:1:{i:0;s:6:""Subbed"";}","PG-13 - Teens 13 or older","During Maeda Kazuya's first year of high school he felt like a nobody, just another forgotten face shuffling through the crowded hallways. Even his best friend from childhood, Nimi, seemed somehow more difficult to approach, since she had matured a little quicker in the unsettling way that girls have a habit of doing. However, this year, things will be different for Kazuya, and part of that change may just be because of the big new girl magnet hanging in front of him: the used digital SLR he just received from his dad! But will just having a camera be enough to make talking to girls a snap? Well, if he stays focused and has enough talent to make them look good, it might just be! And since it’s digital, there are no negatives or having to wait for things to develop! Will Kazuya's new stock in trade click with the most beautiful girls in school, or will his career as a lensman be just a flash in the pan? Find out as he goes for total exposure in PHOTO KANO!",NULL,"13","23",NULL,"English: Photo Kano
Japanese: フォトカノ",NULL,"7.0000",NULL,"1392118000",NULL,"2013-05-03 18:13:09","2013-06-28 18:19:01","43500"
"277","2","Koi to Senkyo to Chocolate","koi-to-senkyo-to-chocolate","2013/05/Koi-to-Senkyo-to-Chocolate.jpg",NULL,"TV","Complete","2012-07-06","0000-00-00","a:1:{i:0;s:6:""Subbed"";}","PG-13 - Teens 13 or older","In Japan, participation in extra-curricular activities is as fundamental a part of an education as chalk and gym shorts. However, not all students are overachievers, and for those like Yuki Ojima, groups like the Food Research Club are welcome havens in which to slack-off. But what's a slacker to do when the radical new candidate for Student Council president announces her intent to get rid of clubs like the FRC? Well, getting the help of the current Student Council president is a good start, but HIS suggestion is so counter-intuitive that it's crazy: Yuki should run for the Student Council himself? And yet, it's SO crazy that it just might work! Especially when Chisato, the chocolate-adverse president of the FRC (and Yuki's best childhood friend,) and members of other targeted school clubs start to join the swelling FRC army. But can this army of goofs and goof-offs coast all the way to political victory? Or will someone have to step up to the plate and take one for the term? ","1","13","25",,"English: Love, Elections & Chocolate
Japanese: 恋と選挙とチョコレート",NULL,NULL,NULL,"0",NULL,"2013-05-05 12:50:04","2013-12-29 07:05:12","43573"
"278","2","Mushibugyou","mushibugyou","2013/05/Mushibugyou.jpg",NULL,"TV","On-going","2013-04-08","0000-00-00","a:1:{i:0;s:6:""Subbed"";}","PG-13 - Teens 13 or older","The action story is set in Edo-era Tokyo in the early 1700s. The eighth shogun Tokugawa Yoshimune ordered boxes to be installed so commoners can submit their thoughts. After hearing their voices, the shogun creates a new magistrate unit—Mushibugyou—to protect the people in the heart of the city. Each member is a specialist with unique fighting skills.
","1","26","23",,"English: Mushibugyou
Japanese: ムシブギョー 蟲奉行",NULL,NULL,NULL,NULL,NULL,"2013-05-06 10:39:38","2014-01-19 16:22:11","43618"
"279","2","Aku no Hana","aku-no-hana","2013/05/Aku-no-Hana.jpg",NULL,"TV","Complete","2013-04-05","2013-06-30","a:1:{i:0;s:6:""Subbed"";}","R - 17+ (violence & profanity)","Darkness lurks everywhere, in every human heart, and sometimes it takes just a second of weakness for it to take root. For Kasuga Takao, that germination begins when his obsession with his beautiful classmate Nanako meets the opportunity to borrow her used gym clothes. Unfortunately, his loathsome act of laundry theft is witnessed by Nakamura, the strange girl who sits behind him in class. Soon, Nakamura's own dark obsessions begin to hook their twisted tendrils into Takao's miserable existence. Blackmailed into a contract under the threat of having his guilt revealed to his entire class, the former bookworm who could spend hours reading Beaudelaire's The Flowers of Evil now finds himself entwined in Nakamura's growing fantasies as she leads him down the garden path to damnation. As their blossoming relationship becomes ever darker, even the seemingly innocent Nanako is pulled into the nightmare. Just what are Nakamura's ultimate plans, and will the increasingly trapped Takao really be willing to carry them out? What you sow, you must ultimately reap, and there's certain to be a harrowing harvest ahead in FLOWERS OF EVIL!","1","13","24","Flowers of Evil","English: Flowers of Evil
Japanese: 惡の華",NULL,NULL,NULL,NULL,NULL,"2013-05-06 11:07:54","2013-08-14 17:45:27","43649"
"280","2","Arata Kangatari","arata-kangatari","2013/05/Arata-Kangatari.jpg",NULL,"TV","Complete","2013-03-23","2013-07-02","a:1:{i:0;s:6:""Subbed"";}","PG-13 - Teens 13 or older","Every 30 years, a new princess is chosen from the Hime family to serve the Hayagami. The time has come again, but over these past years, records state not a single female has been born, save for one, the 15-year-old Arata. The only problem is, Arata is actually a male! Forced to disguise himself and take the place of the princess candidate until a formal one can be found, he attends the festival only to witness the current princess, Kokuri-hime, murdered, and his own life is forfeit as well, by the hands of the princess' personal guard, the 12 Shinshou. As he runs for his life, Kannagi of the 12 convinces everyone that Arata is the one who has murdered the princess instead, and now everyone in the Imperial Court is after his head!
","1","12","23","Arata: The Legend","English: Arata: The Legend
Japanese: アラタ カンガタリ ~革神語~",NULL,NULL,NULL,NULL,NULL,"2013-05-07 16:34:19","2013-08-14 17:45:13","43718"
"281","2","Aiura","aiura","2013/05/Aiura.jpg",NULL,"TV","Complete","2013-04-10","2013-06-25","a:1:{i:0;s:6:""Subbed"";}","PG-13 - Teens 13 or older","The story centers around Amaya, Iwasawa, and Uehara—three ""annoying, spirited high school girls with zero motivation""—and their classmates. Their daily life is ""what happens when there is nothing happening.""
 ","1","12","4",,"English: Aiura
Japanese: あいうら",NULL,NULL,NULL,NULL,NULL,"2013-05-08 14:00:10","2013-08-14 17:45:23","43816"
"282","2","Yuyushiki","yuyushiki","2013/05/Yuyushiki.jpg",NULL,"TV","Complete","2013-04-10","0000-00-00","a:1:{i:0;s:6:""Subbed"";}","PG-13 - Teens 13 or older","The story follows the school life of the three girls, Yuzuko, Yukari, and Yui who join their high school's Data Processing Club.
","1","12","23",,"English: Yuyushiki
Japanese: ゆゆ式",NULL,NULL,NULL,NULL,NULL,"2013-05-08 15:41:57","2013-08-21 00:48:36","43848"
"283","2","Dansai Bunri no Crime Edge","dansai-bunri-no-crime-edge","2013/05/Dansai-Bunri-no-Crime-Edge.jpg",NULL,"TV","Complete","2013-04-04",NULL,"a:1:{i:0;s:6:""Subbed"";}","R - 17+ (violence & profanity)","Haimura Kiri is a seemingly ordinary boy with one slight problem: he is obsessed with cutting other people's hair. One day he meets Mushanokouji Iwai, the Hair Queen who cannot cut her hair because of an inherited curse. Kiri finds out that his scissor, Dansai Bunri no Crime Edge is the only thing that can cut them. But little did he know that their meeting sparked the start of an old murder game to kill the Hair Queen using the cursed killing tools, the Killing Goods. Can Kiri protect Iwai from the Killing Goods Owners? Let the game begin!",NULL,"13","24",NULL,"English: The Severing Crime Edge
Japanese: 断裁分離のクライムエッジ",NULL,NULL,NULL,NULL,NULL,"2013-05-09 11:53:17","2013-05-09 11:53:17","43880"
"284","2","Karneval","karneval","2013/05/Karneval.jpg",NULL,"TV","Complete","2013-04-04",NULL,"a:1:{i:0;s:6:""Subbed"";}","PG-13 - Teens 13 or older","Nai searches for someone important to him, with only an abandoned bracelet as a clue. Gareki steals and pick-pockets to get by from day to day. The two meet in a strange mansion where they are set-up, and soon become wanted criminals by military security operatives. When Nai and Gareki find themselves desperate in a hopeless predicament, they encounter none other than the country's most powerful defense organization—""Circus""!!
",NULL,"13","24",NULL,"English:  Karneval
Japanese: カーニヴァル",NULL,"8.0000",NULL,"1389193889",NULL,"2013-05-10 05:52:05","2013-06-29 01:35:11","43923"
