"1","3","Sekirei","sekirei","2012/05/sekirei.jpg",NULL,"TV","Complete","2008-07-02","2008-09-17","a:2:{i:0;s:6:""Subbed"";i:1;s:6:""Dubbed"";}","R+ - Mild Nudity","Minato Sahashi is extremely intelligent, yet due to his inability to cope under pressure has failed the college entrance exam twice. As a result he has been branded an idiot and loser by many. One day after talking to his yet again disappointed mother he comes into contact with a girl named Musubi who was under attack. The girl runs but takes him with her and soon finds that Minato, while unknown to him, is an Ashikabi, one of the mysterious set of masters that have the genetic trait that can become partners with some of the 108 cute girls, buxom women, and bishonen called ""Sekirei"". The reason for the partnership allows the Sekirei to use all their power to win in the competition held by the mysterious MBI corporation.","1","12","24",,"Japanese: セキレイ",NULL,NULL,NULL,NULL,NULL,"2012-02-01 00:00:47","2013-08-28 06:53:09","18759"
"2","3","One Piece","one-piece","2012/02/onePiece1.jpg",NULL,"TV","On-going","1999-10-20","0000-00-00","a:2:{i:0;s:6:""Subbed"";i:1;s:6:""Dubbed"";}","PG-13 - Teens 13 or older","Gol D. Roger was known as the Pirate King, the strongest and most infamous being to have sailed the Grand Line. The capture and death of Roger by the World Government brought a change throughout the world. His last words before his death revealed the location of the greatest treasure in the world, One Piece. It was this revelation that brought about the Grand Age of Pirates, men who dreamed of finding One Piece (which promises an unlimited amount of riches and fame), and quite possibly the most coveted of titles for the person who found it, the title of the Pirate King. Enter Monkey D. Luffy, a 17-year-old boy that defies your standard definition of a pirate. Rather than the popular persona of a wicked, hardened, toothless pirate who ransacks villages for fun, Luffy’s reason for being a pirate is one of pure wonder; the thought of an exciting adventure and meeting new and intriguing people, along with finding One Piece, are his reasons of becoming a pirate. Following in the footsteps of his childhood hero, Luffy and his crew travel across the Grand Line, experiencing crazy adventures, unveiling dark mysteries and battling strong enemies, all in order toreach One Piece.","1","626","24",,"English: One Piece
Japanese: ワンピース",NULL,"7.1495",NULL,"1405541605",NULL,"2012-02-26 21:03:28","2014-07-01 07:06:35","10534"
"3","3","Nurarihyon no Mago","nurarihyon-no-mago","2012/03/Nurarihyon.jpg",NULL,"TV","Complete","2010-07-03","2010-12-20","a:2:{i:0;s:6:""Subbed"";i:1;s:6:""Dubbed"";}","PG-13 - Teens 13 or older","Rikuo Nura appears to be an average middle school student. No one knows that he comes home every day to a house full of youkai, nor that he transforms into the all-powerful leader of these spirits at night. However, much to the disappointment of many, Rikuo is determined to live as normal a life as possible.","1","24","24","Nura: Rise of the Yokai Clan","English: Nura: Rise of the Yokai Clan
Synonyms: The Grandson of Nurarihyon, Grandchild of Nurarihyon
Japanese: ぬらりひょんの孫",NULL,NULL,NULL,NULL,NULL,"2012-03-14 23:38:26","2013-08-10 21:36:25","15418"
"4","3","Yuru Yuri","yuru-yuri","2012/03/YuruYuri.jpg",NULL,"TV","Complete","2011-07-05","2011-09-20","a:1:{i:0;s:6:""Subbed"";}","PG-13 - Teens 13 or older","Right after starting middle school, Akari Akaza joins the Amusement Club which is composed solely by her two childhood friends, Kyouko Toshinou and Yui Funami. Chinatsu Yoshikawa, Akaza's classmate, becomes a member after finding out about the dissolution of the Tea Club. 

The Amusement Club, situated at the tea room facility since the Tea Club disbanded, has no clear purpose, being free for the girls to do whatever they want.","1","12","23",,"English: 
Japanese: ",NULL,NULL,NULL,NULL,NULL,"2012-03-15 15:50:26","2013-08-20 17:25:39","15509"
"5","3","Yumeiro Patissiere","yumeiro-patissiere","2012/02/yumeiroPatissiere.jpg",NULL,"TV","Complete","2009-10-04","2010-09-26","a:1:{i:0;s:6:""Subbed"";}","PG - Children","14-year-old Ichigo Amano is incredibly clumsy and can't seem to do anything right besides eating cakes. When she stumbles upon a Sweets Festival, she meets Henri sensei who acknowledges her ability of taste and invites her to transfer to St. Marie Academy to become a pâtissière. Ichigo has trouble adjusting initially, but with the help of the 3 Sweets Princes and the Sweets Spirits, she gains the confidence and skill to work towards becoming a pâtissière! ","1","50","24",,"English: 
Japanese: ",NULL,"6.0000",NULL,"1389700960",NULL,"2012-03-15 16:21:08","2013-08-20 17:31:09","15510"
"6","3","Working!! 2","working-2","2012/03/Working2.jpg",NULL,"TV","Complete","2011-10-01","2011-12-24","a:1:{i:0;s:6:""Subbed"";}","PG-13 - Teens 13 or older","Life goes on at the Wagnaria family restaurant as its peculiar employees try to provide a good service despite their individual eccentricities.","1","13","24",,"English: 
Japanese: ",NULL,NULL,NULL,NULL,NULL,"2012-03-15 16:30:54","2013-08-20 17:43:11","15511"
"7","3","Working!!","working","2012/03/working.jpg",NULL,"TV","Complete","2010-04-04","2010-06-27","a:1:{i:0;s:6:""Subbed"";}","PG-13 - Teens 13 or older","Set in a family restaurant in Hokkaido, the northern prefecture of Japan, 16-year-old high school student Souta Takanashi works part-time along with his strange co-workers: Popura Taneshima, a high school girl who's a year older than Souta, yet easily mistaken for an elementary/middle schooler, and Kyoko Shirafuji, the 28-year old store manager who doesn't bother to do any work at all. ","1","13","24",,"English: 
Japanese: ",NULL,NULL,NULL,NULL,NULL,"2012-03-15 16:35:33","2013-08-20 17:44:24","15512"
"8","3","Vampire Knight: Guilty","vampire-knight-guilty","2012/03/VampireKnightGuilty.jpg",NULL,"TV","Complete","2008-10-07","2008-12-30","a:1:{i:0;s:6:""Subbed"";}","PG-13 - Teens 13 or older","As a direct continuation of the first season, Zero comes back after his disappearance from the academy. Despite her relief, Yuuki, whose past is still shrouded in mystery, wonders what exactly happened to Zero during the separation. As Zero continues having the strange vision that appeared since the day he drank Kaname’s blood, he visits the now awakened Maria Kurenai in an attempt to find answers. She only provides him with a cryptic answer that suggests who the true enemy really might be.

In the meantime, vampires from the Supreme Vampire Council arrive at the academy in order to punish Zero with death for his sin of killing a pureblood. However, Kaname intervenes with the council's decision with not only the intention of saving Zero but with another purpose unbeknown to everyone around him.","1","13","24",,"English: 
Japanese: ",NULL,"8.0000",NULL,"1388316725",NULL,"2012-03-15 16:55:33","2013-08-20 17:59:47","15513"
"9","3","Vampire Knight","vampire-knight","2012/03/VampireKnight.jpg",NULL,"TV","Complete","2008-04-08","2008-07-01","a:1:{i:0;s:6:""Subbed"";}","PG-13 - Teens 13 or older","Cross Academy is an elite boarding school with two separate, isolated classes: the Day Class and the Night Class. On the surface, Yuuki Cross and Zero Kiryuu are prefects of the academy, and attempt to keep order between the students as classes rotate in the evenings. As the night class is full of utterly gorgeous elites, this can sometimes prove to be a bit difficult. It is completely necessary, however, as those ""elites"" are actually vampires. Yuuki and Zero act as guardians, protecting the secrets of the Night Class and the safety of the ignorant day class.

As the adopted daughter of the academy's chairman, Yuuki takes her job with a serious and energetic attitude. It also allows her to interact with her secret crush and savior, the night class' dorm president, Kaname Kuran. Zero, on the other hand, has a deep-rooted hatred against vampires, and at times, does not hesitate to kill.

Can vampires and humans co-exist, even in the strict setup of the Cross Academy? Only time will tell.","1","13","24",,"English: 
Japanese: ",NULL,"8.0000",NULL,"1388317144",NULL,"2012-03-15 16:59:35","2013-08-20 18:01:18","15514"
"10","3","Usagi Drop","usagi-drop","2012/03/UsagiDrop.jpg",NULL,"TV","Complete","2011-07-08","2011-09-16","a:1:{i:0;s:6:""Subbed"";}","PG-13 - Teens 13 or older","While attending his grandfather's funeral, thirty-year-old bachelor Daikichi is surprised to discover that his grandfather had an illegitimate child with an unknown mother! The rest of his family, fearing the obligation and embarrassment, want nothing to do with the silent little girl, Rin. Sensing her imminent abandonment and outraged by his complacent family members, Daikichi decides to adopt her himself! ...yet he may have underestimated the difficulty of balancing his work, family, and love life with his role as her guardian.","1","11","24",,"English: Bunny Drop
Japanese: うさぎドロップ",NULL,"10.0000",NULL,"1388436411",NULL,"2012-03-15 17:11:53","2013-08-20 18:05:12","15515"
"11","3","Tsubasa Reservoir Chronicle","tsubasa-reservoir-chronicle","2012/03/tsubasa.jpg",NULL,"TV","Complete","2005-04-09","2005-10-15","a:1:{i:0;s:6:""Subbed"";}","PG-13 - Teens 13 or older","During an excavation at the mysterious ruins in Clow Country, Syaoran discovers his childhood friend Princess Sakura appear on the site with wings that disperse into many feathers. As the feather’s disappear to different dimensions, so does Sakura’s memory. In attempts to save Sakura’s life and restore her memory, Syaoran travels through to another world to find a solution. There’s only one thing left he can do. Travel through to different dimensions to collect Sakura’s feathers. Helping out with the quest is Kurogane, an exiled ninja from Japan Country who wishes to return to his world, the runaway magician, Fay, who desires to jump between each world never to return to his own and the white meat-bun shaped creature, Mokona.","1","26","24",,"English: Tsubasa Chronicle
Japanese: ツバサ・クロニクル",NULL,NULL,NULL,NULL,NULL,"2012-03-15 17:18:26","2013-08-20 18:59:43","15516"
"12","3","True Tears","true-tears","2012/03/trueTears.jpg",NULL,"TV","Complete",NULL,NULL,"a:1:{i:0;s:6:""Subbed"";}","PG-13 - Teens 13 or older","Shinichiro is a student living in what would be a dream come true for most high school boys, but for him is mostly a frustration. A well liked girl in school named Hiromi has lived in his house for a year along with his family. Her father was a close friend of the family, and when he died they immediately took her in. She is popular and well liked, always smiles, is talented in sports- but Shinichiro knows there must be tears inside her. Having an artistic tendency, he makes watercolours of her and thinks about wishing to ease her tears. Yet he cannot bring up the nerve to talk to her even in his own home. She, too, is quiet and withdrawn in their house, quite unlike at school. Shinichiro is also distracted by teasing from his friend Nobuse for watching Hiromi from afar, a curse of bad luck from a strange girl named Noe, and being forced to perform Muhiga dancing. By helping Noe he hopes to ease his own problems, yet he seems to have difficulty helping himself.",NULL,"13","24",NULL,"English: True Tears
Japanese: ",NULL,NULL,NULL,NULL,NULL,"2012-03-15 17:29:09","2013-05-16 05:08:35","15518"
"13","3","Toriko","toriko","2012/02/toriko.jpg",NULL,"TV","On-going","2011-04-03","0000-00-00","a:2:{i:0;s:6:""Subbed"";i:1;s:6:""Dubbed"";}","PG-13 - Teens 13 or older","In the world where the taste and texture of food are very important there is Toriko, a hunter of precious foods regularly hired by restaurants and the rich. A man with inhuman skills to capture the ferocious, evasive and rare animals to complete his ultimate dinner course and then the chef Komatsu, his current accomplice: a weak timid person who was inspired by Toriko's greatness and accompanies him on all his journeys on his quest for the course of his life.","1","135","23",,"English: Toriko
Japanese:  トリコ",NULL,NULL,NULL,NULL,NULL,"2012-03-15 17:42:28","2013-10-01 04:52:18","15519"
"14","3","Toradora!","toradora","2012/03/toradora.jpg",NULL,"TV","Complete","2008-10-02","2009-03-26","a:1:{i:0;s:6:""Subbed"";}","PG-13 - Teens 13 or older","It's a new school year and Ryuuji Takasu discovers that not only is he in the same class as his best friend, Yuusaku Kitamura, but also Minori Kushieda whom he's had an undisclosed crush on for quite some time. Along with the two of them comes the “Palmtop Tiger”, tiny Taiga Aisaka and Minori's best friend. Despite her small stature, Taiga takes nothing from anybody and is secretly in love with Kitamura. Ryuuji and Taiga, despite their oil and water relationship, agree to mutually support each other in their quests for their hearts' desire.","1","25","24",,"English: Toradora!
Japanese: とらドラ！",NULL,NULL,NULL,NULL,NULL,"2012-03-17 08:30:47","2013-08-22 21:35:41","15626"
"15","3","Kami nomi zo Shiru Sekai II","kami-nomi-zo-shiru-sekai-ii","2012/03/TheWorldGodOnlyKnows2.jpg",NULL,"TV","Complete","2011-04-12","2011-06-28","a:2:{i:0;s:6:""Subbed"";i:1;s:6:""Dubbed"";}","PG-13 - Teens 13 or older","Katsuragi is back, and together with Elsie the hunt for loose souls continues on. This time however, they are joined by Elsie's friend and fellow Demon, Haqua.","2","12","23",NULL,"English: The World God Only Knows II
Japanese: 神のみぞ知るセカイ II",NULL,NULL,NULL,NULL,NULL,"2012-03-17 08:35:02","2013-07-30 00:05:15","15629"
"16","3","Kami nomi zo Shiru Sekai","kami-nomi-zo-shiru-sekai","2012/03/TheWorldGodOnlyKnows.jpg",NULL,"TV","Complete","2010-10-07","2010-12-23","a:2:{i:0;s:6:""Subbed"";i:1;s:6:""Dubbed"";}","PG-13 - Teens 13 or older","Keima Katsuragi, a second-year high school student, is an avid dating sim gamer. He is known on the Internet as ""The Capturing God"" for his legendary skills to be able to ""capture"" any 2D girl in games. However, in his actual school life, Keima is known as otamegane, a derogatory portmanteau of the two words otaku (オタク) and megane (メガネ-""glasses"").

At the start of the series, Keima receives an e-mail offering him a contract to ""capture"" girls. He accepts what is thought to be a challenge, and a demon from Hell nicknamed Elsie appears. She asks for his cooperation to help her in catching the runaway spirits. These spirits hide themselves inside the girl's heart, and Elsie suggests that the only method to force the spirits out is by ""capturing"" their hearts—making them fall in love. Appalled by the idea, Keima refuses after clarifying to Elsie that he is only interested in ""capturing"" 2D girls and that he detests reality. Nevertheless, with the contract already accepted, Keima would have to help Elsie no matter what; if they fail, both Elsie and Keima would lose their heads.","1","12","23","The World God Only Knows","English: The World God Only Knows
Japanese: 神のみぞ知るセカイ",NULL,NULL,NULL,NULL,NULL,"2012-03-17 08:37:14","2013-07-30 10:31:56","15630"
"17","3","The Melancholy of Haruhi Suzumiya","the-melancholy-of-haruhi-suzumiya","2012/03/The-Melancholy-of-Haruhi-Suzumiya.jpg",NULL,"TV","Complete","2006-04-03","2006-07-03","a:1:{i:0;s:6:""Subbed"";}","PG-13 - Teens 13 or older","Kyon, your typical high school student, has long given up his belief in the supernatural. However, upon meeting Haruhi Suzumiya, he quickly finds out that it is the supernatural that she is interested in; aliens, time travelers and espers among other things. When Haruhi laments about the lack of intriguing clubs around school, Kyon inspires Haruhi to form her own club. As a result, the SOS Brigade is formed, a club which specializes in all that is the supernatural.

Much to his chagrin, Kyon, along with the silent bookworm, Yuki Nagato, the shy and timid Mikuru Asahina, and the perpetually smiling Itsuki Koizumi, are recruited as members. The story follows the crazy adventures that these four endure under their whimsical leader, Haruhi. The story is based on the light novels by Nagaru Tanigawa.","1","9","23",,"English: The Melancholy of Haruhi Suzumiya
Japanese: 涼宮ハルヒの憂鬱",NULL,"10.0000",NULL,"1389029968",NULL,"2012-03-17 08:42:57","2013-08-23 21:01:34","15631"
"18","3","Tengen Toppa Gurren Lagann","tengen-toppa-gurrun-lagann","2012/03/Tengen-Toppa-Gurrun-Lagann.jpg",NULL,"TV","Complete","2007-04-01","2007-09-30","a:2:{i:0;s:6:""Subbed"";i:1;s:6:""Dubbed"";}","PG-13 - Teens 13 or older","In a far away future, mankind lives underground in huge caves, unknowing of a world above with a sky and stars.

In the small village of Jiha, Simon, a shy boy who works as a digger discovers a strange glowing object during excavation. The enterprising Kamina, a young man with a pair of rakish sunglasses and the passion of a firey sun, befriends Simon and forms a small band of brothers, the Gurren Brigade, to escape the village and break through the ceiling of the cave to reach the surface, which few believe exist.

The village elder won't hear of such foolishness and punishes the Brigade. However, when disaster strikes from the world above and the entire village is in jeopardy, it's up to Simon, Kamina, a girl with a big gun named Yoko, and the small yet sturdy robot, Lagann, to save the day.

The new friends journey to the world above and find that the surface is a harsh battlefield, and it's up to them to fight back against the rampaging Beastmen to turn the tide in the humans' favor! Pierce the heavens, Gurren Lagann!","1","27","24",,"English: Tengen Toppa Gurren-Lagann, Making Break-Through Gurren Lagann, Heavenly Breakthrough Gurren Lagann, Gurren Lagann, TTGL
Japanese: 天元突破グレンラガン",NULL,NULL,NULL,NULL,NULL,"2012-03-17 08:45:42","2013-08-23 21:05:46","15632"
"19","3","Tantei Opera Milky Holmes Season 2","tantei-opera-milky-holmes-season-2","2012/03/Tantei-Opera-Milky-Holmes-Season-2.jpg",NULL,"TV","Complete","2012-01-05","2012-03-22","a:1:{i:0;s:6:""Subbed"";}","PG-13 - Teens 13 or older","Second season of Tantei Opera Milky Holmes.","1","12","23",,"English: Detective Opera Milky Holmes 2
Japanese: 探偵オペラ ミルキィホームズ 第2幕
Alternative: Tantei Opera Milky Holmes Dai 2 Maku",NULL,NULL,NULL,NULL,NULL,"2012-03-17 08:51:58","2013-08-25 06:13:15","15633"
"20","3","Tantei Opera Milky Holmes","tantei-opera-milky-holmes","2012/03/Tantei-Opera-Milky-Holmes-Season.jpg",NULL,"TV","Complete","2010-10-07","2010-12-23","a:1:{i:0;s:6:""Subbed"";}","PG-13 - Teens 13 or older","""Sheryl, Nero, Elly, and Cordelia are the most popular students at Holmes Detective Academy, because of the many cases they've solved with their Toys and teamwork. The students and the people of the Detective City Yokohama all look up to the members of ""Milky Holmes"", as they're called. But on a dark and stormy night, during a battle with their rivals ""The Gentlemen Thief Empire"", they lose their toys, and their fate undergoes a dramatic change...""","1","12","23",,"English: Tantei Opera Milky Holmes
Japanese: 探偵オペラ ミルキィホームズ",NULL,NULL,NULL,NULL,NULL,"2012-03-17 08:54:37","2013-08-25 06:18:30","15634"
"21","3","Special A","special-a","2012/02/specialA.jpg",NULL,"TV","Complete","2008-04-07","2008-09-15","a:1:{i:0;s:6:""Subbed"";}","PG-13 - Teens 13 or older","Hikari Hanazono has always been second to Kei Takishima. When they were six years old, their pro-wrestling loving fathers introduced them to each other. Assuming that she was the best in wrestling, young Hikari challenged Kei to a wrestling match only to be thoroughly defeated by him.

Ever since that fateful incident, Hikari swore to beat Kei in school grades, sporting events - anything. To do this, she has enrolled in the same school as Kei since elementary. Now she attends Hakusenkan, an ultra elite school, that costs her carpenter father a lot of money.

Hikari and Kei are the top two students in the school, with Kei holding firmly to that number one position. While Hikari considers Kei to be a rival and important friend, she is completely unaware that Kei loves her. The story primarily focuses on Hikari and her constant attempts to defeat her one and only rival, Kei, and how she finds love in their rivalry.","1","24","23",,"English: S.A., Special A Class
Japanese: スペシャル・エー",NULL,NULL,NULL,NULL,NULL,"2012-03-17 08:59:57","2013-08-25 22:18:06","15635"
"22","3","Sora no Otoshimono: Forte","sora-no-otoshimono-forte","2012/02/soraNoOtoshimono2.jpg",NULL,"TV",NULL,NULL,NULL,"a:2:{i:0;s:6:""Subbed"";i:1;s:6:""Dubbed"";}","PG-13 - Teens 13 or older","Sakurai Tomoki has settled into his life with the two angeloids, Ikaros and Nymph, and is enjoying himself immensely. However, he keeps having weird dreams and asks all of his friends to help him investigate the cause.

Nymph conjures up a device that enables people, but not angeloids, to enter other people's dreams. The device malfunctions at first but eventually they get to what was supposed to be Tomoki's dream but discover that something is very wrong with it.

Later, a meteor comes crashing down from the skies at the site of the large cherry blossom tree where Tomoki first discovered Ikaros. An extremely well endowed blonde angeloid with a huge sword emerges from the meteor and sets off in search of Tomoki!",NULL,"12","23",NULL,"English: Sora no Otoshimono: f, Lost Property of the Sky 2, Misplaced by Heaven 2, Heaven's Lost Property 2
Japanese: そらのおとしものf（フォルテ）",NULL,NULL,NULL,NULL,NULL,"2012-03-17 09:08:35","2013-03-06 01:37:11","15636"
"23","3","Sora no Otoshimono","sora-no-otoshimono","2012/02/soraNoOtoshimono.jpg",NULL,"TV",NULL,NULL,NULL,"a:2:{i:0;s:6:""Subbed"";i:1;s:6:""Dubbed"";}","PG-13 - Teens 13 or older","Sakurai Tomoki has been having the same strange dream since he was a child
and would wake up in tears. Sugata, an upperclassman at his school, believes
the dream to be of the new continent. Later that night, while waiting under the
cherry trees for Sugata and his childhood friend, an angel called Ikaros comes flying
down and his peaceful life changes from then on.",NULL,"13","23",NULL,"English: Lost Property of the Sky, Misplaced by Heaven
Japanese: そらのおとしもの",NULL,NULL,NULL,NULL,NULL,"2012-03-17 09:11:05","2013-03-06 01:39:47","15637"
"24","3","Shakugan no Shana Season 3","shakugan-no-shana-season-3","2012/03/shakugan3.jpg",NULL,"TV",NULL,NULL,NULL,"a:2:{i:0;s:6:""Subbed"";i:1;s:6:""Dubbed"";}","PG-13 - Teens 13 or older","Continuing from the events of the last series (Shakugan no Shana II), both Shana and Kazumi stand at their respective locations waiting for Yuji to meet with one of them, only to discover that Yuji has disappeared, with not even the slightest evidence of his existence left behind. All is not lost however, as the letters the two of them sent to him still give hope of Yuji's continued existence. As Shana and company search for answers on Yuji's whereabouts, they soon find the truth staring back at them when Yuji reappears in front of them as the leader of Bal Masqué. Left with little choice, Shana must now confront her most unlikely adversary on the battlefield in her toughest challenge yet. ",NULL,"24","23",NULL,"English: Shakugan no Shana Third, Shakugan no Shana 3, Shakugan no Shana Final",NULL,NULL,NULL,NULL,NULL,"2012-03-17 15:37:45","2013-03-06 03:03:17","15643"
"25","3","Shakugan no Shana Season 2","shakugan-no-shana-season-2","2012/03/shakugan2.jpg",NULL,"TV",NULL,NULL,NULL,"a:2:{i:0;s:6:""Subbed"";i:1;s:6:""Dubbed"";}","PG-13 - Teens 13 or older","Shana and Alastor, Lord of the Crimson Realm, continue to do battle with the Denizens, who are trying to steal the Power of Existence from mortals. In the last battle, Yuji is revealed to be a mystes, a ""torch"" of nearly unlimited Power of Existence. Since the Denizens want to capture Yuji and use him to upset the balance of the Realm, Shana resolves to protect Yuji. Yuji then vows to join Shana in her fight.",NULL,"24","23",NULL,"English: Shakugan no Shana Second, Shakugan no Shana 2",NULL,NULL,NULL,NULL,NULL,"2012-03-18 04:18:18","2013-03-06 03:20:05","15644"
"26","3","Shakugan no Shana","shakugan-no-shana","2012/03/shakugan1.jpg",NULL,"TV",NULL,"2005-10-09",NULL,"a:2:{i:0;s:6:""Subbed"";i:1;s:6:""Dubbed"";}","PG-13 - Teens 13 or older","He had thought his normal days would last forever, until they were ended abruptly by an encounter with a girl with red hair and eyes. He named her Shana.

Not long after he enters high school, Sakai Yuji’s normal days come to an end. He sees something bizarre on his way home: people are frozen in a strange fire, and a monster that looks like a large doll is attacking them. Just when he's about to be killed, a girl in a dark cloak wielding a large sword appears, and slices the monster in half. Although Yuji survives the strange encounter, the girl informs him of a desolate truth: "" 'You' don't exist anymore.""

She calls herself a Flame Haze who hunts ""Guze no Tomogara""; intruders from another world. She explains to him that he is a ""Torch"", a substitute of Yuji whose “existence” has already been devoured. She also told him that he is a special Torch, ""Mystes"", which contains a precious item in it. When he looks at his chest, he sees within himself a faint flame, just as she said.

It is in this way that his eternal struggle alongside the girl begins.",NULL,"24","23",NULL,"English: Shana of the Burning Eyes",NULL,NULL,NULL,NULL,NULL,"2012-03-18 04:18:50","2013-03-06 03:14:07","15645"
